title,company,url,published_date,description,scraped_date,skills_found
Senior Full-Stack Engineer,Spear AI,https://weworkremotely.com/remote-jobs/spear-ai-senior-full-stack-engineer,"Mon, 17 Nov 2025 23:43:43 +0000","Headquarters: Washington, D.C. URL: https://spear.ai We’re seeking a skilled Senior Full-Stack Engineer to build the next-generation data management and artificial intelligence platform for maritime domain awareness. Spear AI builds sonobuoy sensors that are deployed into the water and collect edge data. We also work with the U.S. Navy to collect and process their SONAR data. You’ll have an opportunity to work on real-world projects that directly impact warfighter capabilities and mission success. What You’ll Do We’re a small team wearing many hats, and you’d have a wide variety of responsibilities that include: Build out application components and pages. Implement historical and real-time data feeds using WebGPU. Design and develop data models using Postgres and Apache Iceberg. Modify real-time data pipelines using MQTT and Redpanda. Modify offline data pipelines using Dagster for batch processing. Modify and integrate machine learning models or other algorithms into the application. Improve local development and CI/CD using modern tooling and GitHub Actions. Who You Are We’re looking for someone with strong Full-Stack Engineering skills who shares our most important values: You’re fanatical about polish. Every detail matters. You love to make sure your code is linted, formatted, fully typed, and has 100% test coverage. You care about correctness. You take pride in the fact that downstream consumers trust your data. You obsess over performance. You daydream about Lighthouse scores and query speed. You dive deep. It’s important for you to really know how things work. You’re always building prototypes and setting up experiments to reinforce your understanding. You live on the bleeding edge. You’ve got a long list of upcoming platform features you’re excited about and can’t wait for the next nightly to drop. You’re a great teacher. You know how to break down a concept for a specific audience and make it click with them in a way that gets them excited. Why Work With Us We ship — We don’t work on 18-month projects that are irrelevant before they’re even finished. Our work has impact — We build products that are deployed to U.S. submarines and integrate with the sonobuoys we manufacture. We’re growing responsibly — We have the resources to hire a lot more people, but we don’t want to build a massive team of people who don’t share our values. We’re remote — Work from wherever you want. We collaborate in real time on Slack or asynchronously via GitHub. We’re profitable — We aren’t burning through cash trying to make the business work. But we also have investors who believe in us and are committed to our success. We care about doing great work — You don’t need permission to sweat the details here. We don’t take ourselves too seriously — We’re building products that make the world safer. But we don’t let that get to our heads. Important Skills Expertise in TypeScript. Expertise in CSS, such as TailwindCSS. Experience with React and frontend frameworks such as Next.js. Familiar with state management such as React Context. Experience with Node.js, GraphQL, and REST APIs. Proficiency with SQL/PostgreSQL. Knowledge of Docker and Kubernetes. Knowledge of Python. Nice To Have Experience with IoT devices and sensors. Digital signal processing experience. Geospatial analysis and GIS experience. Familiar with working in monorepos. What We Offer Unlimited PTO — Take the time you need to recharge and maintain work-life balance. Dedicated Sick Time — Your health and well-being come first. Comprehensive Health & Benefits – Medical, dental, and vision coverage to keep you and your family protected. 11 Paid Holidays — Enjoy time off throughout the year to celebrate and spend with loved ones. Professional Development — Educational opportunities and resources to help you grow your skills and advance your career. Collaborative Environment — Work directly with leadership in our flat organizational structure, where your ideas and contributions matter. Mission-Driven Work — Contribute to projects that directly support national security and make a real-world impact. Growth Opportunities — Join us during an exciting expansion phase where you can help shape our future. Additional Benefit Opportunities When You Choose Spear AI: 401(k) with company match. On-site / Remote / Flexible work arrangements or hybrid options (position dependent). Relocation assistance (position dependent). Referral bonuses. Performance bonuses. Life insurance and disability coverage. Technology home office setup stipend. Professional certification reimbursement (position dependent). We offer competitive compensation tailored to your experience, location, and the impact you’ll make. We’re committed to equitable pay and will share a range aligned to your level and geography during the hiring process. In accordance with state law, candidates in jurisdictions such as CA, CO, WA, NY, and others, where applicable, will be provided a good-faith salary range upon request and through the hiring process. This is a full-time, exempt position under the Fair Labor Standards Act (FLSA) and is not eligible for overtime pay. Compensation for this position is provided on a salaried basis and is not subject to reduction based on hours worked. At Spear AI, you’ll find more than just a job; you’ll join a mission-driven team where your work directly contributes to national security. Our flat organizational structure means your voice matters, your ideas reach leadership, and your impact is visible. As we grow, we’re committed to building robust processes and infrastructure that support both our mission and our people. We value collaboration, continuous improvement, and the expertise each team member brings to the table. If you’re looking for a place to grow professionally while working on projects that truly matter, we’d love to hear from you. To apply: https://weworkremotely.com/remote-jobs/spear-ai-senior-full-stack-engineer",2025-12-08,"['python', 'typescript', 'react', 'docker', 'kubernetes', 'sql', 'postgresql', 'node.js', 'machine learning', 'ai', 'ci/cd']"
Full Stack Javascript Developer (Shape Up + Small team),Inovo Studios,https://weworkremotely.com/remote-jobs/inovo-studios-full-stack-javascript-developer-shape-up-small-team-1,"Thu, 18 Sep 2025 17:09:48 +0000","Headquarters: Nashville, TN URL: https://www.tribesocial.io Tribe Social is a dynamic platform that fosters community engagement and content creation through a robust social infrastructure. We empower creators and users alike with real-time interactions, media sharing, and seamless integration across web and mobile. We are seeking a talented Full-Stack JavaScript Developer to join our team and contribute to building and scaling our platform. We want builders —not just coders. If you thrive in an environment where autonomy, ownership, and impact matter, you’ll love working with our team. Our Application Process We work async as much as possible, so most of this process will be automated. Submit application Email async interview 25 min intro video call 90 min code review call Paid trial project ($50/hr x 25 hr) Pro Tip: Writing and recording video is our primary form of communication, so leverage that! Our tech stack: Backend: Node.js with Sequelize ORM for MySQL Frontend: React.js with TailwindCSS Mobile: Flutter (built using FlutterFlow) Databases: MySQL for web/core app, Firebase for mobile app CI/CD: CircleCI for testing and deployment Media Processing: LivePeer for video transcoding How We Work At Tribe Social , we don’t follow traditional Agile, Scrum, or Kanban methodologies. Instead, we embrace Shape Up from 37 Signals , a product development framework designed to avoid endless planning, micromanagement, and scope creep. Fixed Time, Variable Scope – We work in monthly cycles with clear priorities. We decide how much time we want to spend on a problem and shape solutions to fit within that timeframe. Shaping – Before a project gets scheduled, we shape it —defining the problem, solution, risks, and constraints upfront. Only well-formed, concrete ideas make it to development. Team of 1 – No micromanaging. No back-and-forth over tiny details. You decide how to execute within the defined problem space. Pair Project Management – You're not alone, but working together with one of our team for each step of the project Working Meetings - We thrive with async comms for updates. We use virtual calls to untangle issues and write code together. To apply: https://weworkremotely.com/remote-jobs/inovo-studios-full-stack-javascript-developer-shape-up-small-team-1",2025-12-08,"['javascript', 'react', 'mysql', 'node.js', 'ci/cd', 'agile', 'scrum']"
Experienced Ruby Product Engineer,Silverfin,https://weworkremotely.com/remote-jobs/silverfin-experienced-ruby-product-engineer,"Mon, 17 Nov 2025 10:57:05 +0000","Headquarters: Gent, Belgium URL: https://silverfin.com/ We start with the cliff notes about the position. If this appeals to you, continue reading for a longer text about working at Silverfin and your role At Silverfin, we're an equal opportunity employer and value diversity at our company. Although we know we’re not perfect yet, we are working hard on it and always open for your feedback. According to our vision to build a diverse, equitable and inclusive organisation, our policy is to only make a final hiring decision if underrepresented groups are sufficiently represented in the list of candidates applying for the position. For this reason it’s possible interviews get slightly delayed until we’ve reached that goal. We're committed to elevating talent by creating an environment where we can all thrive together. So if you think you have what it takes, but don't necessarily check every single box, please consider applying. We'd love to hear how you might contribute to our mission and our team. What can we offer you? Actual, proper work-life balance Flexible working hours and work 100% remotely Personal growth training and opportunities Join a distributed remote-first engineering team with 40+ colleagues in 14 different countries on two continents A refreshing work environment with professional, friendly and welcoming colleagues A €1200 yearly budget for conferences, courses, workshops or other expenses that will improve your skills Two engineering retreats per year, somewhere in Europe Ten company-wide Wellbeing Days per year for all employees (once a month, except in July and August) Compensation For this role, the compensation range is  €104.000 - €130.000 a year , which reflects the total compensation band for senior engineers at this level. Please note: Most candidates start at the lower to mid part of the range, depending on experience and how their profile compares to our existing team. The higher end of the range is typically offered to individuals with a track record of strong impact and deep expertise in similar roles. We run annual compensation reviews, so there is clear opportunity for growth as you progress in the role. What will you work on? Figure out the best way to solve a customer or business problem in close collaboration with a product manager, a product designer and other engineers Work on user facing functionalities Help with discovery and delivery of a solution Give the engineering perspective on potential ways of approaching a specific challenge Help with maintenance and support of existing functionality What are we looking for? You’re experienced in both Ruby and Rails, and also understand where the boundaries lie between them. You can code in Ruby without any of Rails’ training wheels if necessary. You have experience using Javascript framework(s), understand the value of them, but also know when plain Javascript is enough. You're interested in getting to know our customers to find the best solution for a given challenge. You can communicate clearly in English, both in writing and verbally. You’re up for mentoring coworkers and can give in-depth, productive feedback during code reviews. While you appreciate the small stuff, you recognise bike-shedding and can avoid its pitfalls. You know and can apply best practices when relevant. That means the usual like version control, testing, and refactoring; but also higher level concepts such as good object oriented design. You're aware of the trade-offs involved in proper engineering and can make balanced business decisions, keeping in mind all the stakeholders of the project. You’ve got opinions on code design and you can discuss them, but you’re professional enough to not let those opinions get in the way of a consensus if necessary. If you’re any good at Ruby, this is probably not the first job ad you’ve seen, so we’ve done our best to stand out while also accurately presenting what we’re all about. If it sounds like you would enjoy working with us, don’t hesitate to apply or drop us a line with questions , or read on for the more detailed explanation .. What’s a Silverfin? At Silverfin we’re trying to apply the promise of software to the age-old industry of accounting. With our SaaS we’re automating a large chunk of the busy-work that accountants are currently handling manually, and are building new tools so they can provide better services to their customers. We aim to optimise their workflow in such a way that accountants can spend more time on the much more impactful and rewarding work of advising their customers, the business owners. The good news is we’re succeeding in doing exactly that. Every week more than 15.000 financial service professionals use Silverfin to help and advise more than 400.000 businesses. Our customers adore us! The even better news is there’s still plenty left to work on, and that’s where we hope you come in. Since November 2023 we are proudly part of Visma - the European leader in mission-critical cloud software, enjoying the power of the Visma brand and resources whilst retaining business autonomy and go-to-market freedom. What’s the product team like? The product team is a cross-functional team where engineers work together closely with product managers and product designers. The team's input is a user or business problem which it can solve with a high degree of autonomy. From day one all profiles are involved in understanding the problem, ideating solutions and doing quick experiments to prove that a certain solution might actually lead to the desired outcome. After the discovery phase the same team is tasked with the delivery of the chosen solution. The team will then track the adoption of the solution and will make sure that the problem is actually solved. The setup of the team is largely based on the book ""Inspired"" by Marty Cagan. What does working at Silverfin look like? Next to the four product teams, there are three more platformy teams, who own complex subsystems, like syncs or AI, and or support the product teams with knowledge, frameworks and services. Our ops team ensures things run smoothly, deploys happen correctly, and will work with you when issues should arise. We’re enthusiastic followers of the devops mindset, which means ops and developers work together to solve problems, and empower each-other to be self-sufficient, instead of throwing problems over the wall to the “other side”. We run an up-to-date Rails monolith on the backend, with PostgreSQL and Redis for persistence and caching, and everything is running on a Kubernetes cluster in Google Cloud. Our daily tools include GitLab, Quip and Slack, with Google Meet as our remote conferencing tool of choice. No code gets deployed without a code-review by a peer and testing is a must. Our pipeline automates deployment when the suite is green, and deploys happen dozens of times a day. Each team is currently doing Kanban, but they’re free to follow whatever process suits them best. There are regular retros held to work towards continuous improvement. Software for accountants is not considered to be very exciting, but we have our fair share of technical challenges. To give you a sense of scale: our database exceeds 10TB*, and our largest table has crossed the 10 billion row mark a long while back. We interface with more than 30 different external APIs, and provide third parties an API of our own. *: Our ops team noted that this actually isn’t that hard to achieve if you’re just indexing everything, but it still sounds impressive, right? What makes the engineering team at Silverfin special? We’re a remote-first engineering team of 40 people distributed in 14 different countries over two continents. A priority for us is maintaining proper work-life balance. We avoid meetings as much as possible, accept deadlines only when absolutely necessary, and never expect anyone to work longer hours than they’ve signed up for. A day in our working lives is pretty boring, and we feel that’s exactly how it should be. Working with us means you can be flexible with your schedule. It’s OK to disappear for a few hours in the middle of the day to run some errands, get a haircut, pick up the kids - whatever reason, you don’t need to explain yourself. You also fully decide when you take time off: our team is sufficiently varied and well organised that there are always enough people around to handle the load, and in the rare cases it’s not, we will decrease the load instead of asking people to move their holiday. Being remote-first means we favour asynchronous communication. We don’t shy away from chatting in Slack, but the important decisions or discussions are done in Gitlab issues, over email, or in Quip, so there’s a written, persisted record. We’re mindful of maintaining long chunks of focussed time, which means we avoid @-mentions or PMs on Slack, and other triggers and interrupts. We encourage using Slack’s DnD function, especially when you’re not working! We’d be really happy to welcome you in our #engineering channel, but it’s not just virtual: we make sure we regularly get to see each other in real life too. Twice a year we fly the whole engineering team together to a different location in Europe, and at least once a year we join up with the rest of the company so we can spend some time together with the other departments. What does your future look like? Personal growth is key to staying motivated. At Silverfin you don’t need to move to management in order to advance. We see the individual contributor track and the management track as two different growth paths which every engineer can follow and switch between. You can be promoted, including pay raises, as a contributor just like as a manager. Everyone has a €1200 yearly budget to spend on conferences, courses, workshops or other training to improve their skills and level up. This also includes accommodation, travel costs. If the conference is on a workday you’ll get paid like any normal day. Requirements You have at least 4 years of experience working with Ruby, or 2 years of experience with Ruby and 4 years in one or more other programming languages You have experience Javascript framework(s) Your work hours have some overlap with EU business hours (we require your local timezone to be within CET +/- 3h) You can communicate clearly in English, both written and verbally Nice to haves These would be nice but are definitely not necessary. Don’t worry if none of the following applies to you. Experience as a remote worker in a fully remote team Experience working with large datasets and the problems they bring Experience with Vue.js Experience in Fintech Accounting knowledge Interested? You can apply today and we’ll start having interviews from 24/11/2025. There’s no benefit to applying early, so you can take your time answering the application questions. Read about what our interviewing process looks like We may use artificial intelligence (AI) tools to support parts of the hiring process, such as reviewing applications, analyzing resumes, or assessing responses. These tools assist our recruitment team but do not replace human judgment. Final hiring decisions are ultimately made by humans. If you would like more information about how your data is processed, please contact us. To apply: https://weworkremotely.com/remote-jobs/silverfin-experienced-ruby-product-engineer",2025-12-08,"['javascript', 'vue', 'kubernetes', 'postgresql', 'redis', 'ai']"
