title,company,url,published_date,description,scraped_date,skills_found
Senior Golang Developer,Lemon.io,https://weworkremotely.com/remote-jobs/lemon-io-senior-golang-developer,"Wed, 12 Nov 2025 12:52:17 +0000","Headquarters: New York, NY URL: https://lemon.io Are you a talented Senior Developer looking for a remote job that lets you show your skills and get decent compensation? Look no further than Lemon.io — the marketplace that connects you with hand-picked startups in the US and Europe. What we offer: The rate depends on your seniority level, skills and experience. We've already paid out over $11M to our engineers. No more hunting for clients or negotiating rates — let us handle the business side of things so you can focus on what you do best. We'll manually find the best project for you according to your skills and preferences. Choose a schedule that works best for you. It’s possible to communicate async or minimally overlap within team working hours. We respect your seniority so you can expect no micromanagement or screen trackers. Communicate directly with the clients. Most of them have technical backgrounds. Sounds good, yeah? We will support you from the time you submit the application throughout all cooperation stages. Most of our projects involve working in a fast-paced startup environment. We hope you like it as much as we do. Through our community, we will connect you with the best developers from more than 50 countries. Requirements: 4+ years of software development experience 3+ years of experience in Golang programming, with strong knowledge of the Go programming language, paradigms, constructs, and idioms Expertise in AI and Kubernetes is a plus Strong technical skills: as a Senior Developer, you are expected to be able to create projects from scratch and have a deep understanding of application architecture. Clear and effective communication in English — advanced ability to discuss business tasks, justify decisions, and communicate issues. Good self-presentation is also essential for upcoming client calls. Strong self-organizational skills — ability to work full-time remotely with no supervision. Reliability — we want to trust you and expect that you won’t let us and the client down. Adaptability and Flexibility — the ability to onboard the project promptly after accepting it and start delivering results quickly. Sounds good for you? Apply now and join the Lemon.io community! NOT YOUR TECH STACK? We have multiple projects available for Senior Developers. If you have 4+ years of commercial software development experience and are proficient in any of the following areas: React & Node, React & Python, Rust, Shopify & JavaScript, Node & Python, WordPress, Unreal Engine, PHP & Vue, Svelte & TypeScript, Svelte & Node, Svelte & Python, MLOps, Data Engineering, React Native & Node, PHP & React, Data Analysis, Blockchain, PHP & Angular, Swift & SwiftUI, Node & Vue.js, DevOps, Data Science, Unity, Python & LLM or AI Engineering — we’d be happy to connect and match you with a suitable project. If your experience matches our requirements, be ready for the next steps: VideoAsk — watch a short video about our startup, up to 10 minutes Complete your profile on our website 30-minute screening call Technical interview Feedback Magic Box (we are looking for the best project for you). We do not provide visa assistance, and our cooperation model does not include the benefits typically offered with direct hire. P.S. We work with developers from 50+ countries in different regions: Europe, LATAM, the U.S (if you are an owner of W-9 ben form), Canada, Asia (Japan, Singapore, South Korea, Philippines, Indonesia), Oceania (Australia, New Zealand, Papua New Guinea), and the the UK. However, we have some exceptions. At the moment, we don’t have a legal basis to accept applicants from the following countries: European: Iceland, Liechtenstein, Kosovo, Belarus, Russia, and Serbia. Latin America: Cuba and Nicaragua Most Asian countries and Africa. We expand and shorten the list of exemptions regularly. We do not provide visa assistance, and our cooperation model does not include the benefits typically offered with direct hire. Do you represent a company with engineers who match the description and want to collaborate with us through staff augmentation? Then register here . To apply: https://weworkremotely.com/remote-jobs/lemon-io-senior-golang-developer",2025-12-08,"['python', 'javascript', 'typescript', 'react', 'angular', 'vue', 'kubernetes', 'ai']"
Senior Fullstack Developer (.NET),Proxify AB,https://weworkremotely.com/remote-jobs/proxify-ab-senior-fullstack-developer-net,"Wed, 12 Nov 2025 11:56:40 +0000","Headquarters: Sweden URL: http://career.proxify.io The Role: We are looking for a Senior Fullstack .NET Developer to join our fast-growing Network. In this role, you’ll own the design and implementation of backend services and APIs using .NET (C# / ASP.NET Core), while delivering polished, performant user interfaces using modern frontend technologies and .NET-driven UI frameworks. You will collaborate with product managers, designers, and other engineers to deliver end-to-end features, make architectural decisions, and mentor more junior engineers. This is a long-term, full-time remote engagement. You’ll have the opportunity to work with modern cloud platforms, CI/CD pipelines, and deliver impactful features in real products used by customers around the world. What we are looking for: 5+ years of professional software development experience, with strong fullstack exposure. Relational databases - MSSQL experience. 3+ years of production experience with .NET (C#, .NET Core / .NET 6+) and ASP.NET Core. Solid knowledge of JavaScript/TypeScript, HTML5 and CSS3, or experience with .NET UI frameworks such as Blazor and Razor Pages. Experience with relational databases (e.g., SQL Server, PostgreSQL) and ORM tooling such as Entity Framework Core. Strong understanding of RESTful API design and integration patterns. Experience with automated testing (unit, integration) and test frameworks for both backend and frontend. Practical experience with containerization (Docker) and familiarity with CI/CD pipelines (e.g., GitHub Actions, Azure DevOps, GitLab CI). Experience deploying and operating services in the cloud (Azure preferred, AWS/GCP acceptable). Ability to work independently and deliver high-quality results in a remote setup. Intermediate-advanced English Located in CET timezone (+/- 3 hours), we are unable to consider applications from candidates in other time zones. Nice-to-have: Deep experience with TypeScript and modern frontend tooling (Vite, Webpack). Proven experience with Blazor, ASP.NET MVC or other .NET-centric UI frameworks. Familiarity with microservices patterns, DDD, CQRS or event-driven architectures. Experience with container orchestration (Kubernetes). Knowledge of message brokers (e.g., RabbitMQ, Kafka, Azure Service Bus). Experience with GraphQL and schema design. Exposure to performance tuning, caching strategies and observability (logs, tracing, metrics). Responsibilities: Design, implement, and operate scalable backend services using .NET (C#, ASP.NET Core). Build and maintain responsive, accessible user interfaces using modern frontend technologies and/or .NET UI frameworks (e.g., Blazor, Razor Pages). Design and consume robust RESTful APIs (and optionally GraphQL) and integrate with databases and external systems. Ensure code quality through testing (unit/integration), code reviews, and automated pipelines. Drive architectural decisions for backend, frontend, and their integration (microservices, monoliths, or hybrid). Collaborate with designers and product teams to translate requirements into technical solutions and great user experiences. Troubleshoot production issues, optimize performance, and ensure application reliability and security. Mentor and coach other engineers, contribute to best practices and team processes. Participate in an agile development process and help continuously improve delivery and observability. Document design choices, API contracts, and deployment procedures. What we offer: Get paid, not played No more unreliable clients. Enjoy on-time monthly payments with flexible withdrawal options. Predictable project hours Enjoy a harmonious work-life balance with consistent 8-hour working days with clients. Flex days, so you can recharge Enjoy up to 24 flex days off per year without losing pay, for full-time positions found through Proxify. Career-accelerating positions at cutting-edge companies Discover exclusive long-term remote positions at the world's most exciting companies. Hand-picked opportunities just for you Skip the typical recruitment roadblocks and biases with personally matched positions. One seamless process, multiple opportunities A one-time contracting process for endless opportunities, with no extra assessments. Compensation Enjoy the same pay, every month with positions landed through Proxify. To apply: https://weworkremotely.com/remote-jobs/proxify-ab-senior-fullstack-developer-net",2025-12-08,"['javascript', 'typescript', 'aws', 'azure', 'gcp', 'docker', 'kubernetes', 'sql', 'postgresql', 'ci/cd', 'agile']"
Senior Fullstack Developer (React.js & Node.js),Proxify AB,https://weworkremotely.com/remote-jobs/proxify-ab-senior-fullstack-developer-react-js-node-js,"Wed, 12 Nov 2025 11:51:08 +0000","Headquarters: Sweden URL: http://career.proxify.io The Role: We are looking for a Senior Fullstack Developer skilled in React.js and Node.js for one of our clients. You are a perfect candidate if you are growth-oriented, you love what you do, and you enjoy working on new ideas to develop exciting products. What we are looking for: 5+ years experience as a Fullstack Developer. Backend experience with: Node.js Microservices architecture Database experience with: SQL MongoDB Intermediate-advanced English Nice-to-have: Located in CET timezone (+/- 3 hours). Database Architecture knowledge. Responsibilities: Ability to build libraries and frameworks of reusable efficient code. Competence in designing and implementing low-latency, stable and performing applications. Capacity to effectively collaborate with other team members and stakeholders remotely. Ability to implement data protection systems. Competence in data storage solutions. What we offer: Get paid, not played No more unreliable clients. Enjoy on-time monthly payments with flexible withdrawal options. Predictable project hours Enjoy a harmonious work-life balance with consistent 8-hour working days with clients. Flex days, so you can recharge Enjoy up to 24 flex days off per year without losing pay, for full-time positions found through Proxify. Career-accelerating positions at cutting-edge companies Discover exclusive long-term remote positions at the world's most exciting companies. Hand-picked opportunities just for you Skip the typical recruitment roadblocks and biases with personally matched positions. One seamless process, multiple opportunities A one-time contracting process for endless opportunities, with no extra assessments. Compensation Enjoy the same pay, every month with positions landed through Proxify. To apply: https://weworkremotely.com/remote-jobs/proxify-ab-senior-fullstack-developer-react-js-node-js",2025-12-08,"['react', 'sql', 'mongodb', 'node.js']"
Senior Backend Developer (Python),Proxify AB,https://weworkremotely.com/remote-jobs/proxify-ab-senior-backend-developer-python-4,"Wed, 12 Nov 2025 11:14:49 +0000","Headquarters: Sweden URL: http://career.proxify.io The Role: We are looking for a Senior Python Developer for one of our clients. You are a perfect candidate if you are growth-oriented, you love what you do, and you enjoy working on new ideas to develop exciting products. What we are looking for: 5+ years of experience building products with Python and Django. High proficiency in SQL with experience using databases like PostgreSQL. Experience scaling cloud infrastructures with Docker or Kubernetes is a plus. Experience managing cloud infrastructures, specifically AWS or GCP. You follow the best practices and conventions. Relevant experience in CI/CD and related tools. Ability to work with minimal supervision. Intermediate-advanced English level. You can communicate well with both technical and non-technical clients. Time zone: CET (+/- 3 hours). We are unable to consider applications from candidates in other time zones. Responsibilities: Ability to build libraries and frameworks of reusable efficient code. Competence in designing and implementing low-latency, stable and performing applications. Capacity to effectively collaborate with other team members and stakeholders remotely. Ability to implement data protection systems. Competence in data storage solutions. What we offer: Get paid, not played No more unreliable clients. Enjoy on-time monthly payments with flexible withdrawal options. Predictable project hours Enjoy a harmonious work-life balance with consistent 8-hour working days with clients. Flex days, so you can recharge Enjoy up to 24 flex days off per year without losing pay, for full-time positions found through Proxify. Career-accelerating positions at cutting-edge companies Discover exclusive long-term remote positions at the world's most exciting companies. Hand-picked opportunities just for you Skip the typical recruitment roadblocks and biases with personally matched positions. One seamless process, multiple opportunities A one-time contracting process for endless opportunities, with no extra assessments. Compensation Enjoy the same pay, every month with positions landed through Proxify. To apply: https://weworkremotely.com/remote-jobs/proxify-ab-senior-backend-developer-python-4",2025-12-08,"['python', 'aws', 'gcp', 'docker', 'kubernetes', 'sql', 'postgresql', 'django', 'ci/cd']"
"Software Engineer, Business Experience",CodeSignal,https://weworkremotely.com/remote-jobs/codesignal-software-engineer-business-experience-1,"Wed, 12 Nov 2025 08:56:02 +0000","Headquarters: San Francisco URL: https://codesignal.com/ We are looking for a Software Engineer who wants to be an impactful part of a small team looking to change the way technical hiring is done. In this role, you will be an integral part of our Product Engineering team and will drive features with immediate business impact to our core products: Assessments , Interviews , and Learn . You’ll be a key member of the team that builds and maintains our identity and authentication systems, tying all of our products together. To learn more about the kinds of projects we work on, check out our Engineering blog ! Some noteworthy projects include: Why we moved from MongoDB & Meteor observers to Redis What we learned when 10,000 users hit our platform at once How to avoid issues with your HTML email formatting Day-to-Day Contribute to building product features across the full stack (from the front-end to the back-end to separate microservices) Develop clean and maintainable code, with an emphasis on quality and craftsmanship Conduct code reviews and collaborate with your peers Lead technical design discussions on features where you're able to lend your expertise Basic Qualifications At least 4 years of professional, full-time software engineering experience Clear and effective communication skills Drive and initiative for getting things done Experience with TypeScript/JavaScript (browser, Node, or both) Available to work full-time. Candidates must be based within GMT-GMT+6 timezones. Bonus Points for the Following Experience with any part of our stack: React Node MongoDB GraphQL Experience with SSO, SCIM or RBAC. Any experience in a related industry, including assessments, HR tech, or education. To apply: https://weworkremotely.com/remote-jobs/codesignal-software-engineer-business-experience-1",2025-12-08,"['javascript', 'typescript', 'react', 'mongodb', 'redis']"
Senior Software Engineer - BRAZIL,Commure/Athelas,https://weworkremotely.com/remote-jobs/commure-athelas-senior-software-engineer-brazil,"Wed, 13 Aug 2025 23:24:38 +0000","Headquarters: Mountain View, CA URL: https://commure.com About the Role This role will focus on driving the design and implementation of general software that empowers our operations teams to better serve our healthcare providers, thus giving them more time to focus on patients and deliver better services. We are looking for someone with a minimum of two years of software engineering experience. What You’ll Do Build end-to-end products to to scale and empower our operations teams Be a part of a tremendously fast-paced team that celebrates fast execution and decision Work across the entire software stack Work with a stack that includes Python, Vue, React Native, Flask, and other frameworks What You Have At least five years of production software engineering experience Expert in Python Able to work on both frontend (JavaScript, TypeScript, React) and backend (Python) in general and deliver product end-to-end Basic understanding of cloud solutions (GCP, Docker, Kubernetes) Familiarity with modern software development methodologies and cycles Understand standard web-based technologies, such as restful standards and relational databases (eg, PostgreSQL) Have a strong product engineering sense with a can-do builder attitude Able to identify opportunities to improve the current process Strong proficiency in the English language, including the ability to articulate ideas clearly and concisely in both verbal and written formats. Bonus Points If You Have Having worked on greenfield projects before, build and ship products from scratch Worked in the healthcare industry before Experience working in a fast pace environment (we ship fast) Remote work experience Familiarity with BI software The first stage will be a basic take-home assessment. Once we review the submission and the feedback is positive, we will contact you to schedule the first interview. Note: You will not be eligible for benefits as an international contractor at this time. Why you’ll love working at Commure + Athelas: Highly Driven Team: We work hard and fast for exceptional results, knowing we’re doing mission-driven work to transform the country’s largest sector. Strong Backing : We are backed by top investors including General Catalyst, Sequoia, Y Combinator, Lux, Human Capital, 8VC, Greenoaks Capital and Elad Gil. Incredible Growth : Prior to our merger, Commure and Athelas had independently grown more than 500% YoY for three consecutive years. We’ve achieved Series D funding, have an industry-leading runway, and continue to scale rapidly. To apply: https://weworkremotely.com/remote-jobs/commure-athelas-senior-software-engineer-brazil",2025-12-08,"['python', 'javascript', 'typescript', 'react', 'vue', 'gcp', 'docker', 'kubernetes', 'postgresql', 'flask']"
Senior Full-stack Developer,Lemon.io,https://weworkremotely.com/remote-jobs/lemon-io-senior-full-stack-developer-6,"Tue, 11 Nov 2025 15:28:35 +0000","Headquarters: New York, NY URL: https://lemon.io Are you a talented Senior Developer looking for a remote job that lets you show your skills and get decent compensation? Look no further than Lemon.io — the marketplace that connects you with hand-picked startups in the US and Europe. What we offer: The rate depends on your seniority level, skills and experience. We've already paid out over $11M to our engineers. No more hunting for clients or negotiating rates — let us handle the business side of things so you can focus on what you do best. We'll manually find the best project for you according to your skills and preferences. Choose a schedule that works best for you. It’s possible to communicate async or minimally overlap within team working hours. We respect your seniority so you can expect no micromanagement or screen trackers. Communicate directly with the clients. Most of them have technical backgrounds. Sounds good, yeah? We will support you from the time you submit the application throughout all cooperation stages. Most of our projects involve working in a fast-paced startup environment. We hope you like it as much as we do. Through our community, we will connect you with the best developers from more than 50 countries. We have several Senior PHP Full-Stack positions available. Here are the general requirements for these roles. Requirements for PHP & React/Angular/Vue Developer: 4+ years of software development experience 3+ years of experience with PHP 3+ years of commercial experience with React.js, Angular.js or Vue.js Understanding of and practical experience with Next.js is a plus Proficiency in SQL or AI would be a plus but is not mandatory Requirements for PHP & React/Angular/Vue Developer: 4+ years of software development experience 3+ years of experience with Node and Vue.js Experience with Nuxt.js is a must Other requirements: Strong technical skills: as a Senior Developer, you are expected to be able to create projects from scratch and have a deep understanding of application architecture. Clear and effective communication in English — advanced ability to discuss business tasks, justify decisions, and communicate issues. Good self-presentation is also essential for upcoming client calls. Strong self-organizational skills — ability to work full-time remotely with no supervision. Reliability — we want to trust you and expect that you won’t let us and the client down. Adaptability and Flexibility — the ability to onboard the project promptly after accepting it and start delivering results quickly. Sounds good for you? Apply now and join the Lemon.io community! NOT YOUR TECH STACK? We have multiple projects available for Senior Developers. If you have 4+ years of commercial software development experience and are proficient in any of the following areas: React & Node, React & Python, Rust, Golang, Shopify & JavaScript, Node & Python, WordPress, Unreal Engine, Svelte & TypeScript, Svelte & Node, Svelte & Python, MLOps, Data Engineering, React Native & Node, Data Analysis, Blockchain,Swift & SwiftUI, DevOps, Data Science, Unity, Python & LLM or AI Engineering — we’d be happy to connect and match you with a suitable project. If your experience matches our requirements, be ready for the next steps: VideoAsk — watch a short video about our startup, up to 10 minutes Complete your profile on our website 30-minute screening call Technical interview Feedback Magic Box (we are looking for the best project for you). We do not provide visa assistance, and our cooperation model does not include the benefits typically offered with direct hire. P.S. We work with developers from 50+ countries in different regions: Europe, LATAM, the U.S (if you are an owner of W-9 ben form), Canada, Asia (Japan, Singapore, South Korea, Philippines, Indonesia), Oceania (Australia, New Zealand, Papua New Guinea), and the the UK. However, we have some exceptions. At the moment, we don’t have a legal basis to accept applicants from the following countries: European: Iceland, Liechtenstein, Kosovo, Belarus, Russia, and Serbia. Latin America: Cuba and Nicaragua Most Asian countries and Africa. We expand and shorten the list of exemptions regularly. We do not provide visa assistance, and our cooperation model does not include the benefits typically offered with direct hire. Do you represent a company with engineers who match the description and want to collaborate with us through staff augmentation? Then register here . To apply: https://weworkremotely.com/remote-jobs/lemon-io-senior-full-stack-developer-6",2025-12-08,"['python', 'javascript', 'typescript', 'react', 'angular', 'vue', 'sql', 'ai']"
Full Stack Developer,Nova,https://weworkremotely.com/remote-jobs/nova-full-stack-developer,"Mon, 10 Nov 2025 18:45:46 +0000","Headquarters: Toronto, Canada URL: https://www.createwithnova.com/ We are looking for a Full Stack Developer to join our Engineering team, reporting to the EVP Product & Engineering. The role is focused on web development & related infrastructure automation. We are looking for a developer who is comfortable and confident writing Python, SQL, and JavaScript on a daily basis. Competitive salary based on your experience and ability to contribute. You should be familiar with a healthy subset of the following: Languages: Python JavaScript TypeScript HTML CSS Frameworks/libraries: Django React Tailwind FastAPI FastHTML jQuery Puppeteer Jest Node Databases: MySQL Mongo Redis Clickhouse Infrastructure: Google Cloud Platform (GCP) Kubernetes Docker Terraform Linux We’re a 100% remote team: we keep in touch with each other via Slack and Zoom. You must have access to your own workspace with a reliable broadband internet connection (annual stipend for office expenses will be provided). From time-to-time, we hold “on-sites” in person to give everyone some face time with their colleagues (will involve very occasional travel). Preference will be given to applicants located in Canada. To apply: https://weworkremotely.com/remote-jobs/nova-full-stack-developer",2025-12-08,"['python', 'javascript', 'typescript', 'react', 'gcp', 'docker', 'kubernetes', 'linux', 'sql', 'mysql', 'redis', 'django', 'fastapi', 'terraform']"
