title,company,url,published_date,description,scraped_date,skills_found
Senior Software Engineer - Backend/Python - USA Only (100% Remote),Close,https://weworkremotely.com/remote-jobs/close-senior-software-engineer-backend-python-usa-only-100-remote-1,"Wed, 23 Jul 2025 14:31:54 +0000","Headquarters: USA URL: http://www.close.com About Us Close is a bootstrapped, profitable, 100% remote, ~100 person team of thoughtful individuals who prioritize taking ownership and making a meaningful impact. We’re eager to make a product our customers fall in love with over and over again. We 💛 small scaling businesses. Since 2013, we’ve been building a CRM that focuses on better communication, without the hassle of manual data entry or a complex UI. We are out to supercharge sales productivity with the most modern, thoughtfully designed, all-in-one, communication-focused CRM. Our backend tech stack consists primarily of Python Flask web apps with our TaskTiger scheduler handling many of the backend asynchronous task processing chores. Our data stores include MongoDB, PostgreSQL, Elasticsearch, and Redis. The underlying infrastructure runs on AWS using a combination of managed services like EKS, MSK, RDS and ElasticCache and non-managed services running on EC2 instances. We have CI/CD pipelines that build Docker images, run automated tests and deploy to Kubernetes clusters. We also use these images in our local development environment allowing coding locally against all of our services. We have a well-documented public API that is consumed by our front-end JavaScript app as well as numerous integrations. Our infrastructure is heavily automated using Terraform, Ansible and other AWS tools. Our product development process is inspired by Shape Up . We love open sourcing our code and ideas on our GitHub and on The Making of Close , our behind-the-scenes Product & Engineering blog. Check out our open source projects like SocketShark , TaskTiger , LimitLion and ciso8601 . About the Role You will be joining one of our six cross-functional teams. These are the CRM, Admin & Onboarding, Conversations, Messaging & Scheduling, Automations & Integrations and Data Insights teams. You will be regularly collaborating with other backend & frontend engineers, product managers, designers, and other teams here at Close. About You We’re looking for high achieving, full-time Software Engineers to join our engineering team. Someone who has a good understanding in web technologies and wants to help design, implement, launch, and scale major systems and user-facing features. You're comfortable working in a fast-paced environment with a small and talented team where you're supported in your efforts to grow professionally. You're able to manage your time well, communicate effectively, and collaborate in a fully distributed team. Come help us with projects like... Conceiving, designing, building, and launching new user-facing features Implementing new AI features to turbocharge our customers’ daily tasks Improving the performance and scalability of our GraphQL and REST API Improving how we sync millions of sales emails and calendar events each month Working with Twilio's API, WebSockets, and WebRTC to improve our calling features Building user-facing analytics features that provide actionable insights based on sales activity data Improving our Elasticsearch-backed powerful search features Improving our internal messaging infrastructure using streaming technologies like Kafka and Redis Building new and enhancing existing integrations with other SaaS platforms like Google’s G Suite, Zapier, and web conferencing providers Enhancing our web app with real-time updates powered by GraphQL Subscriptions Leveraging the latest AI LLMs from providers like OpenAI, Groq and AssemblyAI Help manage our ever growing data processing needs… Billions of Mongo documents Millions and millions of rows of PostgreSQL data 55 Terabytes of logs / month 500 billion OTEL spans over the last 30 days 10+ million events / day Tens of thousands of docker containers 7 million minutes of call recordings / month Petabytes / month of network traffic Requirements... Senior 1 & 2 level candidates should have 5+ years of experience building modern back-end systems. Staff level candidates should have 8+ years of experience. Mid-level candidates should have ~3 years of similar experience and be eager to level up with the right opportunity. Professional Python experience is preferred but a working knowledge of Python with additional experience in other languages is acceptable if you have a desire to work with Python. You have built web APIs that were Internet facing or supported other high volume loads. You have hands-on production experience working with MongoDB, PostgreSQL, Elasticsearch, or similar data stores. You have experience designing, scaling, debugging, and optimizing systems to make them fast and reliable. You have participated in code reviews and provided overall code quality suggestions to help maintain the structure and quality of the codebase. You care about the craftsmanship of the code and systems you produce. Located in the USA (lower 48 timezones). Bonus point if you have Contributed open source code related to our tech stack. Led small project teams building and launching features. Built B2B SaaS products. Implemented features that leveraged AI to deliver unimaginable new product capabilities. Worked with complex architectures that support multiple APIs (e.g. REST, GQL, WebSockets) as well as async task and event processing frameworks. 🌏 Why Close? Watch our most recent culture video featuring our annual team retreat in Italy 100% remote company 5 weeks PTO + Winter & Summer Holiday Breaks with 2 additional PTO days for every year with the company 1 month paid sabbatical every 5 years Paid parental leave Medical, Dental, Vision with HSA option (US residents) 401k matching at 6% (US residents) Dependent care FSA (US residents) Our story and team 🚀 Our Values Build a house you want to live in -- Examine long-term thinking and action No BS -- Practice transparency and honesty, especially when it’s hard Invest in each other -- Build successful relationships with your coworkers and customers Discipline equals freedom -- Keep your word to yourself and others Strive for greatness -- Constantly challenge yourself and others How We Work Together Productivity, Quality & Impact: We don’t track hours. We trust you’re an adult and know best how to prioritize, meet your goals and contribute at a high level. Asynchronous communication & collaboration: We have team members all over the world. We don’t expect anyone to work untraditional hours, that means our default is async. Most teams have 2-5 hours of internal meetings weekly. Appreciation for Deep Work: *During your normal work day, not after a day of meetings*. Autonomy & Freedom: Create a work environment that is sustainable for you. We place a high amount of trust and responsibility with our team members from the start. We are looking for US-based Software Engineers to join our team. Base salary range for Senior I & II is $140,000 to $210,000. To apply: https://weworkremotely.com/remote-jobs/close-senior-software-engineer-backend-python-usa-only-100-remote-1",2025-12-08,"['python', 'javascript', 'aws', 'docker', 'kubernetes', 'postgresql', 'mongodb', 'redis', 'flask', 'ai', 'ci/cd', 'terraform']"
Senior Python Engineer,Valory AG,https://weworkremotely.com/remote-jobs/valory-ag-senior-python-engineer,"Tue, 21 Oct 2025 11:41:16 +0000","Headquarters: Zug, Switzerland URL: https://olas.network Join the original agent-to-agent protocol in crypto, defining how developers build AI agents in crypto, AI and beyond. Our Mission Olas is the platform that enables true co-ownership of AI. Launched in 2021 as one of the first Crypto x AI projects, today, Olas powers the largest AI agent economies with millions of transactions. Learn more at olas.network. Our Products With Olas’ Pearl , the first “AI Agent App Store”, any consumer with a laptop can use AI agents they truly own. With Olas’ Mech Marketplace , the “AI Agent Bazaar”, businesses can put their AI agent up for hire to earn crypto and tap into other AI agents’ services. Today, Olas’ AI Agents serve diverse use cases - from prediction markets and asset management to influencer agents - autonomously creating valuable outcomes. The OLAS utility token provides access to the platform’s benefits and coordinates agent interactions in entire AI Agent economies. Our Team Valory is the team you’d be joining, working on Olas (the open-source technology governed by the Olas DAO). Valory is VC-backed team of engineers, researchers and commercial executors that raised its own successful Seed round and co-created Olas, executing a successful public token launch and subsequent $13.8m raise for the Olas DAO. We believe Artificial General Intelligence will likely be agentic and must be co-owned. Read more about our values . The Role We’re looking for an exceptional Senior Python Engineer with a passion for decentralized finance and emerging autonomous technologies. You have deep experience designing and building complex, high-performance systems, from architecture to implementation, and thrive in environments where ownership and technical excellence drive every decision. You’re fluent in modern, open-source Python frameworks and have a proven record of shipping production-grade systems at scale. You enjoy shaping architecture, mentoring peers, and solving problems that don’t have playbooks yet. At Valory, you’ll join a world-class team pioneering the next evolution of DeFi: building autonomous on-chain agents that manage digital assets without human intervention. You’ll help push the frontier where AI meets decentralized finance, working on BabyDegen - our cutting-edge DeFi agent and one of the first of its kind.You are excited to work in line with our values , constantly pushing boundaries as the original agent project in the rapidly-expanding AI agent space. Main Duties Develop the BabyDegen family in line with the product roadmap set by the Product Manager Drive the development of the BabyDegen family, translating the product vision and roadmap into robust, production-ready systems. Lead technical design in collaboration with the Product Manager, ensuring new components integrate cleanly and efficiently within a complex, multi-system architecture. Rapidly learn and contribute to Valory’s agents and agent frameworks, taking ownership of adding, maintaining and improving performant, production-grade agents. Champion code quality through comprehensive testing, rapid debugging, and continuous performance optimization Collaborate across functions to lead the design and integration of machine learning features, shaping Valory’s next generation of autonomous products. Produce thorough, high-quality documentation of experiments, outcomes, and design decisions, ensuring knowledge is shared effectively across the organization. Lead by example, providing feedback (including code reviews), learning via others’ feedback, and supporting fellow team members to elevate the entire team. Take full ownership of your work - from implementation to stakeholder communication - ensuring every change meets expectations and delivers measurable value before considering a task done. Stay ahead of the curve on DeFi, crypto, and AI developments - we move fast and iterate even faster. Requirements 4+ years of hands-on experience writing production-level Python (or 2+ years Python and 2+ years in a compiled language such as C++/Go/Rust). Deep understanding of Python frameworks (Django, Flask, FastAPI) and modern engineering practices - linting, auto-formatting, type checking, and automated testing. Excellent communication and collaboration skills; you thrive in a high-autonomy, high-trust environment. Proven ability to design and ship complex, distributed systems or high-throughput backends. Alignment with our values , including mission over ego, clarity through writing and pushing the autonomous edge. Interest in and keenness to dive into emerging areas like AI agents and decentralized systems. Bonus: Open-source contributions or Web3 development experience, familiarity with multi-agent systems or reinforcement learning concepts, demonstrated passion for DeFi, cryptoeconomics, or automation. Location: Hybrid - mostly working from home with regular in-person team meetups, eg multiple times a month, in the London office. Equal Opportunity We are an equal opportunity workplace. We want folks who add diversity on as many axes as possible to bring their expertise, encourage applicants from all backgrounds to apply, and are committed to promoting equality of opportunity. We prohibit discrimination or harassment based on protected characteristics (including gender, race, ethnicity, colour, religion, creed, sex, sexual orientation, national origin, age, disability or marital status). We also respect the wishes of individuals to protect their anonymity online and encourage individuals who operate under pseudonyms to apply. The Opportunity Competitive compensation, accounting for benefits. Hybrid - Valory has been a distributed team from day one, with biannual in-person meetups and an emerging London office. Be part of a pioneering project pushing the boundaries of Web3 - with technology adaptable across finance, media, data, and identity. Work with a world-class team of engineers, researchers, and product leaders building at the intersection of AI, autonomy, and DeFi. Collaborate with leading projects and our global community of agent developers, shaping the next generation of the internet and finance. Help define how developers build AI agents - setting new standards for AI and crypto ecosystems. Please note We do not accept applications without a personalized note explaining your interest in and suitability for this particular role with us. Compensation varies based on the type of engagement. Independent contractors may have higher rates than employees due to differences in tax and benefit structures. To apply: https://weworkremotely.com/remote-jobs/valory-ag-senior-python-engineer",2025-12-08,"['python', 'django', 'flask', 'fastapi', 'machine learning', 'ai']"
Senior / Principal Software Engineer,Weflow,https://weworkremotely.com/remote-jobs/weflow-senior-principal-software-engineer,"Tue, 21 Oct 2025 10:07:12 +0000","Headquarters: Berlin URL: https://www.getweflow.com About Weflow Our mission is to help revenue teams run a repeatable, efficient, and predictable revenue process - instead of wasting time with non-selling activities, internal meetings, or cleaning CRM data. With the rise of AI, we are creating a system that auto-captures & attributes data, provides insights, and run automations & alerts to drive sales performance. 200+ fast-growing companies like BenchSci, Abridge, BluSky, TvScientific, Autorabit, IDnow, and many more use Weflow to improve team productivity, deal execution, and revenue predictability. Backed by Gradient Ventures and Cherry Ventures. Tasks As Senior/Principal Engineer, you’ll play a key role in shaping how Weflow's Revenue AI Platform evolves. You’ll lead the development of deep integrations, build complex AI-driven workflows, and support a rapidly expanding customer base. As Senior/Principal Engineer, you’ll play a key role in shaping how Weflow's Revenue AI Platform evolves.  If you enjoy solving tough engineering problems at scale: let's talk! Requirements 5+ years of experience in software development. Expert-level proficiency in React + Typescript / Next.js, Node.js, PostgreSQL. Experience with AWS services and cloud architecture. Experience with Agile methodologies and CI/CD practices. Solid understanding of software design patterns and architectural distributed computing principles. Experience with DevOps (and actually enjoying doing it) is a big plus. Experience with working in SaaS product companies. Living within the European Union or close to it is preferred to optimize for time zone differences. Benefits Weflow offers competitive pay + equity 100% Remote - Enjoy the freedom to work from anywhere within your country of residence. Annual Paid Leave (PTO). Annual Company Off-Site with all expenses paid. Working at Weflow Weflow is an an equal opportunity employer. All qualified applicants will receive consideration for employment without regard to race, color, religion, sex, national origin, disability, or protected veteran status. To apply: https://weworkremotely.com/remote-jobs/weflow-senior-principal-software-engineer",2025-12-08,"['typescript', 'react', 'aws', 'postgresql', 'node.js', 'ai', 'ci/cd', 'agile']"
Senior Backend Engineer,Proton.ai,https://weworkremotely.com/remote-jobs/proton-ai-senior-backend-engineer,"Wed, 22 Jan 2025 23:59:57 +0000","Headquarters: Cambridge, MA URL: https://proton.ai About Us: The wholesale distribution industry is ready for a revolution, and Proton is leading the charge. The world relies on distributors to sell nearly every physical product, but despite its massive contribution to the global economy, this industry has been left behind in terms of technology. Proton is changing that. With AI-powered sales software, we’re breaking through the complexity of selling millions of products and making it easier for distributors to anticipate customer needs. Our mission is to bring the distribution industry into the modern age and the results speak for themselves. Distributors using Proton see 10x ROI, faster new hire ramp-up, and happier sales teams. In 2022, we raised a $20M Series A backed by Felicis Ventures (investors in Twitch, Shopify, Opendoor, and many others) and Battery Ventures. This year, we’re laser-focused on driving customer growth. If you’re excited about the opportunity to wear multiple hats, and continuously learn and experiment, now’s the time to join the Proton team. The Role: Proton is looking for an experienced Senior Backend Engineer to join our fast-growing SaaS team! Reporting directly to the Director of Engineering, the Senior Backend Engineer will drive the technical development of the Proton.ai product and platform. In this role, you will be working with the engineering team to help us build a scalable, customizable, performant and secure application. We're looking for someone technical with a deep understanding and curiosity of modern tech stacks and systems that will help us choose and implement solutions that benefit the future of our engineering. Proton collaborates with Oyster HR to hire international employees as full time (long term) contractors within our company. Gross Salary range is $50,000 - $70,000  USD annually, based on experience level. What you’ll do: Feature Development: Spearhead the backend coding of new features while helping the Product team understand complexity and tradeoffs. Developing across the entire full stack of our product, driving features from idea to production and rapidly delivering value to our customers that makes a real impact. Team Collaboration: Be part of a cross-functional team, including software engineering, infrastructure, backend, frontend, and devops, to provide architectural guidance, making sure the stack decisions being made support our future growth. Enterprise Customizability : Leverage your experience with enterprise applications to tailor our solutions to the unique needs of our corporate customers. Performance and Reliability: Share your expertise in building high-performance, reliable applications, contributing to end-to-end architecture and data flow discussions. You'll be a great fit for this role if: Proven experience as a principal engineer or similar in startup environments, with a focus on building scalable SaaS solutions. 7+ years of experience building and deploying scalable SaaS applications 5+ years of experience with backend technologies preferably Python or Go, but C# or Java are acceptable Track record of successful product architecture decisions and system improvements with a large focus on secure coding practices and standards to meet the needs of enterprise class customers and their data. Deep understanding of cloud-native technologies and concepts such as cloud providers, databases, application performance, scalability and security Curiosity for new technologies. You’re someone who actively seeks to stay informed about the latest frameworks, software advancements, and tools utilized by industry peers. You like contrasting and comparing technologies to find why one fits better for certain use-cases than the other. Experience with enterprise applications is highly preferred. Exceptional communication skills for conveying complex technical concepts to diverse stakeholders. Current Tech Stack Backend Elasticsearch & Redis as the main databases Actively migrating to SQL as primary database API service in Python running in Kubernetes Daily pre-computations run in Airflow Machine learning AI models - neural networks Machine Learning Eng focused on experimenting with ways to improve existing models, building new models - training and developing models and deploying them Frontend Vue.js 3/Nuxt 3 Migrating Vue Component frameworks from ElementPlus/iView to Vuetify Docker and kubernetes to deploy Github Actions for CI While we have a well-established tech stack, we welcome highly skilled developers who are passionate about learning and expanding their skill set. Don't have experience with everything listed here, but eager to learn? If so, we encourage you to apply! Benefits: Competitive Salaries + Company Stock Options - we want to pay you well (and equitably!) and make you feel like an owner. Flexible Schedule - we think high levels of autonomy, responsibility, and working asynchronously foster an amazing workplace. Biannual Company Paid Off-sites - time for us to be together, brainstorm, and make magic happen. To apply: https://weworkremotely.com/remote-jobs/proton-ai-senior-backend-engineer",2025-12-08,"['python', 'java', 'vue', 'docker', 'kubernetes', 'sql', 'redis', 'machine learning', 'ai']"
C# / .Net developer,AEXGroup,https://weworkremotely.com/remote-jobs/aexgroup-csharp-net-developer,"Tue, 18 Nov 2025 21:17:41 +0000","Headquarters: Aston, PA URL: http://www.aexgroup.net Job Title: C# / .Net developer Location: Aston Employment Type: Experience Level: Mid to Senior About the Role We are seeking a skilled C# Developer with strong experience in JSON data handling and database integration . The ideal candidate will work closely with our engineering and product teams to design, develop, and maintain high-performance applications that interact with various data sources and APIs. Experience with .NET or Transportation Management Systems (TMS) is a strong plus. Key Responsibilities Design, implement, and maintain software solutions using C# . Work with JSON data for configuration, serialization, and data exchange. Develop and optimize database queries (SQL or NoSQL) for data-driven applications. Collaborate with other developers to integrate application components and APIs. Write clean, efficient, and maintainable code following best practices. Participate in code reviews, debugging, and performance tuning. Assist in integrating systems with TMS platforms . Required Qualifications Bachelor’s degree in computer science, Software Engineering, or related field (or equivalent experience). 3+ years of hands-on experience in C# development. Strong understanding of JSON parsing, serialization, and data structures. Solid experience working with relational databases (MySQL, PostgreSQL, SQL Server, etc.). Proficiency in writing and optimizing SQL queries . Experience with software version control (Git). Strong problem-solving skills and attention to detail. Preferred / Nice-to-Have Skills Familiarity with Transportation Management Systems (TMS) . Exposure to RESTful APIs . Knowledge of Linux/Windows build environments . To apply: https://weworkremotely.com/remote-jobs/aexgroup-csharp-net-developer",2025-12-08,"['linux', 'sql', 'postgresql', 'mysql', 'git']"
