title,company,url,published_date,description,scraped_date,skills_found
Full-Stack Engineer,DynamiCare Health,https://weworkremotely.com/remote-jobs/dynamicare-health-full-stack-engineer,"Mon, 18 Aug 2025 16:36:41 +0000","Headquarters: Boston, MA, USA URL: https://dynamicarehealth.com Role Details & Compensation: Annual salary range: $95,000–$115,000, plus equity Unlimited PTO policy and a flexible work schedule This position is 100% remote, and applicants must be located in the United States. While the majority of your work will be performed during regular business hours, this role may occasionally require availability outside typical business hours. Please note: DynamiCare Health does not currently offer medical benefits. While we plan to make this a benefit soon, it is not available at this time. Remote - Full time Must be physically located in the USA Must be authorized to work in the USA with no sponsorship required About Us DynamiCare Health is a digital therapeutics startup that helps people overcome addiction. In 8 peer-reviewed publications, DynamiCare increased quit rates for opioids, stimulants, alcohol, and tobacco by 2-4x compared to typical treatment. DynamiCare has won FDA Breakthrough Status and is already breaking into U.S. healthcare system reimbursement with partners that include the State of Rhode Island, Allegheny County of Pennsylvania, BCBS of Massachusetts, Horizon BCBSNJ, Spring Health, and Cityblock Health. We understand that recovery isn't one-size-fits-all, which is why our platform provides the flexibility and continuous support needed for sustainable behavior change. We're transforming addiction care and helping more people reclaim their lives from substance use disorders. Through the Digital Recovery Platform, DynamiCare is bringing proven therapeutic approaches into the digital age, making recovery support available whenever and wherever our members need it most. About the job Working as a Full-Stack Engineer at DynamiCare, you'll join a fully remote Agile team to design, build, and maintain secure, evidence-based applications. Since we're a small business, you'll have the opportunity to wear many different hats related to DevOps, Security, and other engineering-related fields. As the primary developer at DynamiCare, you'll have ownership over the codebase, making this a huge opportunity for impact. There will also be room for growth in terms of leadership as the team expands, with potential to shape practices, mentor future developers, and take on greater responsibility in technical decision-making. We are currently striving to expand our user base and increase retention rates, with a Series A funding round on the horizon. We use a Ruby on Rails application, which powers multiple subdomains and includes a REST API that supports our member-facing React Native mobile app, as well as an Analytics application utilizing ActionView, React, and Stimulus. We believe DynamiCare is a great place to work. You'll collaborate in real time to make informed product decisions and play an active role in shaping the company's direction every day. We value your time and mental well-being, and we offer flexibility in working hours and time off. While there may be times when you need to jump in to resolve a critical bug, we strive to stay calm, focus on the root cause, and improve our workflows rather than place blame. Here are some examples of the work you might be doing at DynamiCare: Monitoring and responding to mobile and server package vulnerabilities, applying patches promptly, and evaluating whether they pose any risk to our users. Refactor Rails models to enhance feature development and data processing efficiency. Improve our appointment tracking features to include recurring appointments. Maintaining a probability engine used to schedule substance tests, ensuring functionality by writing a comprehensive suite of unit and integration tests. Building new serializers in Rails to help export data in XLSX or CSV format so that our team has insights on key metrics. Creating and maintaining new background jobs to improve the scalability and performance of our application. Ensuring data security, privacy, and compliance with HIPAA. About you We’re seeking a candidate with a passion for technology and a motivation to make the world a better place. Your primary responsibilities will include full-stack development, DevOps, and maintaining strong data security across our platform. You should have at least three years of experience with our core frameworks: Ruby on Rails and React Native. Experience deploying and managing applications using CircleCI, Aptible, and AWS is especially valuable. Experience working within the confines of HIPAA and 42 CFR Part 2 is a strong plus, given the sensitive nature of our work. We’re also looking for someone familiar with Agile development, particularly Scrum and sprint-based workflows. Proficiency with collaboration and project management tools like Asana, Confluence, and Jira is important for staying aligned with the team. Even though you’re experienced, we don’t expect you to hit the ground running on day one. We value thoughtful onboarding and provide you with the time and support needed to learn our systems and processes. Strong communication is essential here, whether you're debugging code, collaborating with designers, or explaining technical concepts to non-technical teammates. We also foster a collaborative environment where every voice is heard, and respectful dialogue and constructive feedback are encouraged. Our shared goal is to build a product that helps people recover from addiction, and we believe that happens best when everyone works together with openness and clarity. A Computer Science degree or equivalent is not required for this position. If you have the chops and the skills needed to do the job well, that’s all that matters. While you’ll report to our Director of IT & Engineering, we strongly believe in autonomy here at DynamiCare. It’s vital that you know how to manage your time, and we trust that you will as well. Investing the time and effort here will help advance your career and expose you to new and exciting challenges. This position is remote and operates on Eastern Time. You’re free to work wherever you succeed the most: whether it be at home or in a coffee shop. We are hiring from anywhere in the United States. Tech Stack Mobile React Native using Expo SDK Integrations Server Ruby on Rails AWS S3 QuickSight Aptible PostgreSQL Data Security HIPAA Compliance DevOps GitHub CircleCI Docker Datadog Sentry How to apply Please submit your application with a resume, a GitHub link, and a cover letter that tells us who you are and what you can offer to DynamiCare, as well as our company’s role in your career and future. Interview Process We aim to make a hiring decision by August 31, 2025. All interviews will be conducted over Zoom. The process includes four stages: Initial Screening – A brief call to learn more about your background and interest in the role. Interview with Direct Manager – A deeper discussion about your experience and technical alignment with the team. Interview with CEO and Head of Product Design – Focused on company vision, product thinking, and cross-functional collaboration. Coding Challenge – A live technical exercise to evaluate your problem-solving skills and coding approach. We value your time and strive to keep the process efficient, respectful, and transparent. You can expect each interview stage to be scheduled approximately 24–48 hours apart during business days. To apply: https://weworkremotely.com/remote-jobs/dynamicare-health-full-stack-engineer",2025-12-08,"['react', 'aws', 'docker', 'postgresql', 'agile', 'scrum']"
WordPress Full-Stack Developer,WPForms,https://weworkremotely.com/remote-jobs/wpforms-wordpress-full-stack-developer,"Fri, 14 Nov 2025 19:43:52 +0000","Headquarters: West Palm Beach, Florida, United States URL: https://wpforms.com/ As a WordPress Developer at WPForms, you'll work on a diverse team that builds & supports a wide-range of websites. We’re looking for someone with experience in eCommerce and multiple payment gateways, with a mind for troubleshooting payment and subscription issues. At WPForms, it’s not just our products that stand out. Our websites are the engines that power our customer experience and many of our products' extended features. We’re looking for a qualified full-stack WordPress Developer to join that team. Our sites don’t just power sales, they extend product functionality using a variety of cloud technologies based in PHP and JavaScript. We need curiosity-driven developers to help us build the next generation of features. You’ll share the ownership and success of website projects with the team, where everyone shares ideas on the technical details of achieving those goals. Your responsibilities will occasionally expand beyond WordPress to support a wide variety of ancillary installations and technologies. We’ve got a lot going on, and we want your help. This includes maintaining and extending existing functionality, optimizing for performance, and securing our codebase. You’ll be responsible for testing your own work and contributing to the reviews of your peers' work as well. We believe in a collaborative environment where your ideas are valued and your growth is supported. This role is perfect for a developer with a strong understanding of WordPress architecture and a desire to build scalable, secure, and high-performing websites. If you're a problem-solver who thrives in a fast-paced environment and is passionate about writing clean, efficient code, we encourage you to apply! Requirements Extremely familiar with WordPress and all of its idiosyncrasies. Experience leveraging and integrating with 3rd Party APIs Coding with modern PHP practices (OOP, autoloading, namespacing, traits, interfaces, etc). JavaScript experience of many flavors (vanilla JS, jQuery, ES6, etc) Familiar with package managers (Composer & NPM) Excellent attention to detail in HTML & CSS/SCSS for great looking sites. Branching & merging workflows and strategies with git & Github. You’re AI-savvy, comfortable using AI tools (Claude Code, Cursor, Co-Pilot, etc.) as part of your daily routine and always looking for ways to leverage AI effectively. WordPress eCommerce experience eCommerce payment experience including Stripe and/or PayPal Comfortable writing performant SQL queries for MySQL WP-CLI proficiency and Linux/Shell scripting skills with the ability to support occasional DevOps tasks. A curious mind, great at troubleshooting Willingness to learn! Bonus points if you also have: Experience creating custom blocks for the Gutenberg (block) editor Familiarity with Continuous Integration / Continuous Deployment (CI/CD) systems Benefits Working for a fast-growing bootstrapped company is a rare opportunity, one we consider a lifestyle choice rather than a job choice. Our positions are challenging, but also come with amazing advantages and fulfillment to those who earn them. Here’s what we offer. Competitive Salary Term Life Insurance and Accidental Death & Dismemberment for all full-time team members during their employment. Health, Dental, and Vision Insurance benefits for full-time U.S. employees. Health Insurance benefits for all employees in India, Pakistan, Brazil, Philippines, Ukraine, Poland, Romania, Nepal, Kenya, Mexico, Nigeria, Spain, Argentina & Jamaica. Work from your home. We’re spread out all over the world – United States, Canada, Ukraine, India, Pakistan, Singapore, and more. Flexible PTO after 90 days of employment. We encourage employees to take the time they need for a vacation, stay healthy, and spend time with friends and family. Holidays (based on your location) Paid Parental Leave. We happily provide or reimburse software you’ll need as well as books or courses that promote continued learning. We cover all costs of company travel (including our annual all-company retreat and mini-team meetups). Additional Perks include AM Welcome Box for new team members, Yearly Anniversary Gifts, and Technology Stipend each work anniversary. We give you the opportunity to solve challenging and meaningful problems that make a difference. Ability to work with some of the best people in the business through frequent, if not daily, interactions. And in case you were wondering: no politics, no b.s., and no jerks. Location This is a remote position - our team is spread around the globe! Our home base is in Florida, USA, so company operating hours are 9am - 5pm ET (UTC -5). While full coverage is not a requirement, you must be available during a portion of the day. Inclusion Statement At Awesome Motive, we strive to have the broadest possible view of diversity, going beyond visible differences to include the background, experiences, skills, and perspectives that make each person unique. Awesome Motive is proud to be an equal opportunity workplace and is committed to equal employment opportunity regardless of race, color, ancestry, religion, sex, national origin, sexual orientation, age, citizenship, marital status, disability, gender identity, veteran status, or any other basis protected by federal, state, or local law. How to apply? If all of this sounds interesting, then please submit your application! Clearly include the following in your cover letter Tell us a bit about yourself and why you should be considered. Details about your experience, qualifications, personality, etc are very helpful. What is your favorite WordPress hook/function and why. What’s something you recently learned that got you excited? Also note, don't forget to proofread before submitting. Check spelling, capitalization, etc. This is your chance to make your application stand out :) Awesome Motive is AI first and we welcome the use of AI - however, our core value of “Paying Attention To Details” means you must proofread everything and take extra care to ensure all sentiments are indeed your own. We won’t be able to individually respond to all applications , but if we feel you’re a strong match, someone will be in touch shortly. Thanks and we look forward to hearing from you! To apply: https://weworkremotely.com/remote-jobs/wpforms-wordpress-full-stack-developer",2025-12-08,"['javascript', 'linux', 'sql', 'mysql', 'ai', 'git', 'ci/cd']"
Remote Front-End Rails Developer,DesignFiles,https://weworkremotely.com/remote-jobs/designfiles-remote-front-end-rails-developer,"Wed, 15 Oct 2025 11:27:24 +0000","Headquarters: Remote URL: https://designfiles.co At DesignFiles, we’re looking for a Front-End Rails Developer with strong JavaScript and UI skills to help shape and improve the creative tools at the heart of our platform. About Us: At DesignFiles, we’re building the go-to platform for interior designers to manage every part of their business—from concept to completion. More than 5,500 customers already rely on our tools, and our remote team of 30+ is growing. If you care about building great products that solve real problems, we’d love to meet you. What You'll Do: Help guide the evolution of our Design/Presentation Editor into a modern, Canva-style experience that supports moodboards, room mock-ups, client presentations, reusable templates, and more. Build intuitive, high-performance UI components for core editing interactions: drag-and-drop, layering, resizing, grouping, alignment, snapping, canvas navigation, and on-canvas text/image editing. Collaborate closely with product and design to translate complex user needs into seamless creative workflows. Shape the architecture and structure of our editor so it's fast, scalable, and easy to maintain as it grows. Contribute to a high-quality, design-forward experience that feels just as good as tools like Canva or Figma — but purpose-built for interior designers. Participate in team rituals like daily standups, sprint planning, and retrospectives. What We're Looking For: Strong vanilla JavaScript skills, including DOM/event handling, canvas or SVG rendering, and performance optimization. Experience building or contributing to visual editors, creative tools, or browser-based design software is a strong plus. Deep understanding of CSS, with hands-on experience using Tailwind or a similar utility-first framework. Proficient with Stimulus.js, Turbo, Hotwire, ViewComponents, and the modern Rails front-end stack. 3+ years of hands-on Ruby on Rails development experience. Takes full ownership of features from concept to deployment—driving high-quality, scalable implementations. Fluent English and clear, professional communication skills. This is a full-time, 40-hour/week remote contract role. We’re specifically seeking candidates (not agencies) based within ±2 hours of Central European Time (CET). If you’ve built or contributed to browser-based editors or creative tools—and care about crafting fast, intuitive, design-friendly experiences—we’d love to talk. To apply: https://weworkremotely.com/remote-jobs/designfiles-remote-front-end-rails-developer",2025-12-08,['javascript']
Remote Growth Engineer (Full-Stack Rails),DesignFiles,https://weworkremotely.com/remote-jobs/designfiles-remote-growth-engineer-full-stack-rails,"Wed, 15 Oct 2025 11:22:18 +0000","Headquarters: Remote URL: https://designfiles.co At DesignFiles, we’re looking for a Growth Engineer with strong full-stack Rails experience to join our product engineering team. About Us: At DesignFiles, we’re building the go-to platform for interior designers to manage every part of their business—from concept to completion. More than 5,500 customers already rely on our tools, and our remote team of 30+ is growing. If you care about building great products that solve real problems, we’d love to meet you. What You'll Do: As a Growth Engineer, you’ll sit at the intersection of engineering, product, and growth. You’ll ship features and run experiments that directly impact customer activation, retention, and monetization. Your work won’t just be about building—it’ll be about measuring, iterating, and optimizing. Run experiments that improve activation, retention, and monetization. Collaborate with product, design, and marketing to test and refine onboarding flows, funnels, and client engagement touchpoints. Use data to uncover friction points in the user journey and ship small, high-impact improvements. Take ownership of experiments end-to-end: scope, build, ship, measure, and iterate. Refine existing features to boost adoption and stickiness. Contribute to a culture of clean code, rapid iteration, and measurable outcomes. Participate in team rituals like daily standups, sprint planning, and retrospectives. What We're Looking For: 5+ years of hands-on Ruby on Rails experience with strong full-stack skills. Proficiency with JavaScript, Stimulus.js, CSS, RSpec, SQL, Docker, Unix Shell. Experience with A/B testing, growth-focused engineering, and/or optimizing onboarding funnels. Strong problem-solving skills and ability to self-unblock. Fluent English and solid communication skills. Team-oriented and comfortable with collaboration, idea-sharing, and code reviews. This is a full-time, 40-hour/week remote contract role. We’re specifically seeking candidates (not agencies) based within ±2 hours of Central European Time (CET). If you’ve got a portfolio of high-impact experiments or user-facing improvements you’ve shipped and iterated on, we’d love to talk. To apply: https://weworkremotely.com/remote-jobs/designfiles-remote-growth-engineer-full-stack-rails",2025-12-08,"['javascript', 'docker', 'sql']"
React/Node Developer,Toptal,https://weworkremotely.com/remote-jobs/toptal-react-node-developer,"Thu, 13 Nov 2025 22:49:34 +0000","Headquarters: Remote URL: https://www.toptal.com/ Summary Client's team builds Mail for Android, iOS, and Web, serving 200M+ users across 40+ countries in 70 languages. As one of the largest email services globally, we deliver 4.5B+ emails daily with top-rated mobile apps. Mail is a key part of our long-term growth, and we're dedicated to providing the best user experience. About the Project We're modernizing our webmail experience to enhance user satisfaction and compete with industry leaders. The team oversees webmail, mobile web, and the classic web version. Remote | 6-12 months | 40 hrs/week (preferred), part-time possible Client-provided MacBook Responsibilities Provide technical leadership in a fast-paced environment Enforce best practices: design reviews, code reviews, CI/CD, TDD Develop high-quality, high-performance features using Node.js/React.js Collaborate with designers, product managers, and engineers Write testable, reliable code and deploy continuously Optimize application performance and scalability Operate and monitor global-scale production systems Requirements BS in Computer Science (or equivalent) with 6+ years of experience Strong CS fundamentals: data structures, algorithms, software design Expertise in React, Redux, Node.js, and responsive design Proficiency in AJAX, HTML5, CSS3, TypeScript, and modern JavaScript Experience with Web Technologies (Node, HTTP, JSON, Webpack, Babel) TDD experience with Jest, WebdriverIO, Enzyme, Protractor, React Testing Library Preferred: Experience developing mail applications Mobile web development expertise Familiarity with Agile methodologies (Scrum, Squad, etc.) To apply: https://weworkremotely.com/remote-jobs/toptal-react-node-developer",2025-12-08,"['javascript', 'typescript', 'react', 'node.js', 'ci/cd', 'agile', 'scrum']"
Frontend Engineer,Mobena,https://weworkremotely.com/remote-jobs/mobena-frontend-engineer,"Fri, 16 May 2025 20:03:34 +0000","Headquarters: New York, NY URL: https://mobena.co/ Mobena is a three-person, remote-first startup building the “evolution” of multi-generational tax/estate planning software, targeting the advisors of America’s 2 million wealthiest families. We’re currently hiring our first dedicated UI Engineer to “own” the frontend of our flagship product, Mobena Evolution, for which we have little to no frontend code. You’ll work directly with our backend/algorithm-focused CTO, as well as our designer-founder, to turn evolving Figma concepts into fast, maintainable, and scalable user interfaces. What You’ll Do Choose and justify the frameworks and tools that best fit our needs. We have some holdover prototype code in Vite JS, but you can take it or leave it; all of our Figma concepts are new. The backend is a standard HTTP API. We are open to everything from established web stacks (React, Angular, Svelte, Vite) to cross-platform or native solutions (Qt, WASM, .NET MAUI, Tauri, Electron, Tk)—literally anything, if you can convince us it’s the right choice. Build our UI from the ground up, establishing clear, maintainable patterns for components, state management, styling, testing, performance, and accessibility. Collaborate to refine and sometimes re-frame existing screen designs in Figma. Connect the frontend to our APIs (REST, GraphQL, or similar). Lay groundwork for future mobile clients; however, experience in this regard is a plus rather than a requirement. About You You’ve shipped an interactive application—web, desktop, or mobile—via coursework, open source, side project or professional work. You care about usability and design quality. (That is, you care about the user.) You learn by doing: building things rather than sitting in committee. You are happy to say I don’t know. We try to cultivate “beginner’s mind” at Mobena—it helps us avoid conventional traps and groupthink. The first step of thinking like a beginner is acknowledging your own ignorance! 😊 You can defend your technical choices in clear English, and can take credit for your successes as well your mistakes. You are comfortable in an early-stage, collaborative environment. To apply: https://weworkremotely.com/remote-jobs/mobena-frontend-engineer",2025-12-08,"['react', 'angular']"
