title,company,url,published_date,description,scraped_date
Senior Frontend Developer,Sanctuary Computer,https://weworkremotely.com/remote-jobs/sanctuary-computer-senior-frontend-developer,"Fri, 12 Dec 2025 18:49:57 +0000","Headquarters: New York City URL: https://sanctuary.computer We are hiring a contract-based Senior Frontend Developer for the garden3d creative collective Original job post link: Senior Frontend Developer About garden3d We are worker owned creative collective, innovating on everything from brands and IRL communities to IoT devices and cross platform apps. We share profit, open source everything, spin out new businesses, and invest in exciting ideas through financial and/or in-kind contributions. Our client roster includes Google , Stripe , Figma , Hinge , Black Socialists in America , ACLU , Pratt , Parsons , Mozilla , The Nobel Prize , MIT , Gnosis , Etsy & Gagosian . We’re the software team behind innovative products like The Light Phone & Mill , and a global, decentralized community space collective called Index Space . We think of our garden3d as collective for creative people, prioritizing a happy, talented, and diverse studio culture. We work on projects that bring value to our world, and we balance deep care for the work we do with a genuine curiosity about life outside of our jobs. Who we’re looking for: We're looking for a Senior Frontend Developer who excels at building pixel-perfect websites using modern frontend frameworks. You'll collaborate with our team to build elegant, performant, and visually stunning web experiences. Your work will span a diverse range of client projects, from immersive brand websites to complex web applications, all requiring a keen eye for detail and technical excellence. In this role, you’ll work on a variety of client projects to find cost-effective, high-quality, pragmatic solutions to complex problems. Responsibilities will include: Collaborating with Technical Lead to meet clients' development needs Building and maintaining high-performance web applications with modern frontend frameworks and tools Implementing responsive, accessible, and pixel-perfect user interfaces based on design specifications Integrating frontend applications with headless CMS platforms, APIs, and third-party services Optimizing application performance, including bundle size, load times, and runtime efficiency Architecting scalable component libraries and design systems for consistency across projects Writing clear documentation for code maintenance and usage Participating in project team meetings, including Sprint Planning, daily standups, and retrospectives Participating in code reviews, providing constructive feedback to teammates and ensuring adherence to best practices The person we’re looking for is happy, relaxed and easy to get along with. They’re flexible on anything except conceits that will lower their usually outstanding work quality. They work “smart”, by carefully managing their workflow and staggering features that have dependencies intelligently — they prefer deep work but are OK coming up to the surface now and then for top level / strategic conversations. We believe people with backgrounds or interests in design, art, music, food or fashion tend to have a well rounded sense of design & quality — so a variety of hobbies or side projects is a big nice to have! Must Have Competencies: We’re always pitching for new and exciting technology niches. Some of the areas below are relevant to us! 8+ years writing highly performant frontend code, an obsession for 95+ Lighthouse scores Expert level experience with Typescript, and one of Next.js, Nuxt, Svelte, Vue Extensive experience with headless CMS like Sanity, Contentful, Prismic or more Fluency in industry standard PaaS like Vercel, Netlify, Firebase, etc Fluency in eCommerce technologies like Shopify (headless & liquid), Stripe, Swell and others Experience building accessible, responsive interfaces with attention to performance optimization and SEO best practices Strong understanding of modern CSS methodologies (Tailwind, CSS Modules, etc) and animation libraries Experience with state management solutions (Redux, Zustand, Pinia) and API integration patterns Proficiency with testing frameworks (Jest, Playwright, Cypress) and commitment to writing maintainable, well-documented code Experience with design systems and component libraries, working closely with designers to ensure pixel-perfect implementations Real-time & performance optimization : experience with WebSockets for live data updates, caching strategies (Redis, CDN-level caching), CDN configuration and optimization (Cloudflare, Fastly), and image optimization techniques including proxies and delivery networks Nice to Have Competencies: We’re always pitching for new and exciting technology niches. Some of the areas below are relevant to us! WebGL & Canvas expertise : experience building interactive graphics, animations, and visualizations using WebGL, Three.js, or native Canvas API Data visualization : creating compelling, interactive data visualizations with libraries like Mapbox, D3.js, Chart.js, or similar tools Full-stack development experience : comfortable working across the entire stack, from frontend to backend and database layers PostgreSQL expertise : strong experience with database design, query optimization, and managing complex relational data structures GraphQL & API design : building and maintaining GraphQL or REST APIs with a focus on performance and developer experience Real-time technologies : experience with WebSockets, Server-Sent Events, or similar technologies for building live, interactive features Authentication & security : implementing secure authentication flows (OAuth, JWT) and following security best practices Client-facing experience : working directly with customers to gather requirements and provide technical solutions Product management experience : defining product roadmaps and collaborating closely with stakeholders Engineering management experience : leading teams, setting technical direction, and mentoring developers Compensation Our pay scale ranges from $35 p/hr to $95 p/hr pending seniority (& team leadership experience), and our projects are rarely less than 8 full time weeks at 40 hours per week. We prefer long standing relationships with highly accountable and communicative team members, so we encourage candidates to expect longer term engagements. How we interview: Our interview process starts with a call where you get to meet a few members of our team. From there we’ll ask appropriate candidates to take part in a technical exercise which helps illustrate skill level and comfort. → It’s also a great way to see what it’s like to work with us and help support folks who may not have the ‘right title’ but have the experience and technical know-how for the role. How we work: We believe that there’s a better balance between the poles of freelancing & full time, and for that reason Sanctuary works differently to most shops: Transparency & Ownership: We release out Profit & Loss statements to the community each year, open source our best ideas, and talk business & money with everyone in the company. We’re proud to run our business with integrity, and for that reason we share everything with our team & community. 150% Carbon Negative: Our studio offsets 150% of the carbon we use to do business each year, dated back to our founding in 2015. We turn down work that is not in-line with our morals, and we encourage our peers to do the same. We have been certified climate neutral since 2021 . Strong Morals: Since our founding, we've turned down somewhere between $1mm - $2mm of work that didn't meet our moral standards. (Most of that was DTC brands that can't show a valid sustainability initiative). Async & Decentralized: We use tools optimized for calm, thoughtful communication, and opt for async whenever possible. We fight hard to maintain our focus time. Remote Friendly: Our company is fluent in remote work, making our workplace more decentralized, and democratized in the process. Ideas & Products: In our spare studio time, we work to build our own open source or internal products to diversify & bolster our income. We create amazing technology products for our clients, so why not for the studio? → Read more on our Substack, over here , or our Medium, over there . Quick tip! Adding a Loom recording to your profile in our form to showcase your skillset can really make your application stand out! Please click the important link below or copy the URL to continue your application. We’d love to learn more about your skill sets and your interest in this role. garden3d Creative Form To apply: https://weworkremotely.com/remote-jobs/sanctuary-computer-senior-frontend-developer",2026-01-04
React Native Developer,Toptal,https://weworkremotely.com/remote-jobs/toptal-react-native-developer,"Fri, 12 Dec 2025 15:05:59 +0000","Headquarters: Remote URL: https://www.toptal.com/ Description We are a global media and tech company that connects people to their passions. We reach nearly 900M people around the world, bringing them closer to what they love—from finance and sports to shopping, gaming and news—with the trusted products, content, and tech that fuel their day. About the Role: We are looking for skilled React Native developers to join our team to guide mobile development efforts and build an app for iOS & Android for our mail platform. Engagement Highlights: - Long term (12+ months ) and full-time opportunity - Overlap: 5+ hours with PST Requirements 8+ years of experience with React Native + iOS + Android + Mobile Apps. Candidate needs to have 3 years of recent React Native hands-on experience. To apply: https://weworkremotely.com/remote-jobs/toptal-react-native-developer",2026-01-04
"Software Engineer, Business Experience",CodeSignal,https://weworkremotely.com/remote-jobs/codesignal-software-engineer-business-experience-1,"Wed, 12 Nov 2025 08:56:02 +0000","Headquarters: San Francisco URL: https://codesignal.com/ We are looking for a Software Engineer who wants to be an impactful part of a small team looking to change the way technical hiring is done. In this role, you will be an integral part of our Product Engineering team and will drive features with immediate business impact to our core products: Assessments , Interviews , and Learn . You’ll be a key member of the team that builds and maintains our identity and authentication systems, tying all of our products together. To learn more about the kinds of projects we work on, check out our Engineering blog ! Some noteworthy projects include: Why we moved from MongoDB & Meteor observers to Redis What we learned when 10,000 users hit our platform at once How to avoid issues with your HTML email formatting Day-to-Day Contribute to building product features across the full stack (from the front-end to the back-end to separate microservices) Develop clean and maintainable code, with an emphasis on quality and craftsmanship Conduct code reviews and collaborate with your peers Lead technical design discussions on features where you're able to lend your expertise Basic Qualifications At least 4 years of professional, full-time software engineering experience Clear and effective communication skills Drive and initiative for getting things done Experience with TypeScript/JavaScript (browser, Node, or both) Available to work full-time. Candidates must be based within GMT-GMT+6 timezones. Bonus Points for the Following Experience with any part of our stack: React Node MongoDB GraphQL Experience with SSO, SCIM or RBAC. Any experience in a related industry, including assessments, HR tech, or education. To apply: https://weworkremotely.com/remote-jobs/codesignal-software-engineer-business-experience-1",2026-01-04
Fully Remote - Founding Full-Stack Senior Engineer (UK ONLY),MyDataValue,https://weworkremotely.com/remote-jobs/mydatavalue-fully-remote-founding-full-stack-senior-engineer-uk-only,"Thu, 11 Dec 2025 20:38:21 +0000","Headquarters: MyDataValue URL: https://www.mydatavalue.com/ £70k – £90k • 0.5% – 2.0% • Fully Remote Must be UK based We are an AI-driven Hospitality Tech platform helping vacation rental owners automate their revenue on Booking.com. Unlike most ""early-stage"" startups, we are already at £100k ARR, growing month-on-month and have investment from angels. We have a product customers love, a validated business model, and we are now preparing to expand to Airbnb and Expedia. We are a lean team of two founders looking for a Founding Engineer. You will be the technical lead, working directly with us to brainstorm ideas, architecture and ship code quickly. The Role This is a Backend-First role (70/30 split). You will spend most of your time in Python/Django, but you must be willing to jump into React/Tailwind to ship complete features ‍ We have interesting technical challenges involving high-volume data and browser automation (MCP/AI) Scale the Backend: Build and ship features using Python (Django) and Postgres. High-Volume Scraping: Manage enterprise-level scraping (1,000s of requests/second) and reverse-engineering of public data sources. Chrome Extension: Maintain and expand our extension that bridges our platform with customer accounts. Ship Fast: We use ChatGPT/Copilot heavily to speed up boilerplate code so we can focus on the complex logic. Frontend (Light): We use React/Tailwind. You don't need to be a frontend expert, but you should be willing to jump in and tweak UI when needed. The Logistics One founder is in Leeds, the other in London. We'd like to meet up occasionally to brainstorm & speed up onboarding as well in person. Salary: £70k - £90k (depending on experience). Equity: Up to 2% options (4-year vesting). We are aiming for a £5-10m valuation in our next raise, join now to get in at the ground floor. Who You Are A Builder: You have startup experience (founder or early employee). You care about solving problems, not just writing code. Python Expert: You have deep experience with Python. Data Scraper: You understand the nuances of web scraping, proxies, and browser automation (Playwright). Pragmatic: You know when to build for scale and when to ship a ""hacky"" fix to unblock a customer. Autonomy: You want direct responsibility. You hate micromanagement and love taking a ticket from ""idea"" to ""deployed."" Interview process - 30 min non technical call with myself. - 1 hour technical pair programming challenge (not leetcode but real-life problems) - Meet up in person with both founders - Offer Why This Role? Real Revenue: We aren't just an MVP, we have customers who have been with us for months earning more revenue with 0% churn. High Equity: 2% is a good chunk for our stage, it should be worth a significant amount within a years time as we raise at higher valuations. Hard Problems: If you get bored building standard CRUD apps, our scraping, MCP & automation challenges will keep you engaged. To apply: https://weworkremotely.com/remote-jobs/mydatavalue-fully-remote-founding-full-stack-senior-engineer-uk-only",2026-01-04
Senior Symfony Developer,BBE Marketing Inc,https://weworkremotely.com/remote-jobs/bbe-marketing-inc-senior-symfony-developer,"Thu, 11 Dec 2025 19:01:56 +0000","Headquarters: Hurst, TX URL: http://bbemarketing.com/ We are seeking a skilled developer with strong experience in Symfony (Angular front-end) , and a product-focused mindset . This role requires someone who not only codes but also understands the ""why"" behind tasks, ensuring features are designed and implemented to enhance the user experience. Our service connects businesses with talent from all of the world so that they can book, hire, and collaborate with them. If you’re a problem solver who enjoys taking ownership of your work and collaborating with a dedicated team, this role is for you. Key Responsibilities Develop new features and improve existing functionality in Symfony applications. Fix bugs and implement updates swiftly while maintaining high-quality standards. Collaborate with team members to understand the purpose behind each task and the end user’s needs. Implement features and layouts that are intuitive and user-friendly without requiring design skills. Perform thorough testing of your work – there’s no dedicated QA team, so attention to detail is critical. Make architectural decisions to improve scalability and performance. Maintain quality checks, metrics, and monitoring (e.g., automated testing, error reporting, and performance monitoring tools). Why You'll Love This Role Direct Collaboration: Work closely with team members, from the CEO to Customer Support, in a flat, no-bureaucracy environment. Product Ownership: Think beyond coding by understanding the user’s perspective and optimizing feature placement and usability. Fast-Paced Environment: If you enjoy shipping features quickly and iterating without unnecessary perfectionism, this role is perfect for you. Problem-Solving: We value team members who take initiative and craft solutions that strike the right balance between simplicity and effectiveness. Trust: You’ll have the autonomy to manage your tasks and the company’s confidence to handle sensitive information responsibly. Requirements Symfony Expertise: Proven experience building and maintaining applications in Symfony. Product Mindset: Ability to think like a product manager by considering the user’s needs and ensuring features are practical, intuitive, and well-placed. Front-End Implementation: Proficiency in HTML, CSS, and Angular (or similar frameworks) to build user-friendly layouts. Design skills are not required , but understanding user flows and logical placement is essential. Database Knowledge: Strong understanding of MySQL (or other RDBMS). Testing Skills: Ability to write tests in PHP (e.g., PHPUnit) and front-end testing (e.g., Jasmine). Bonus for experience with CI pipelines. Version Control: Comfortable working with Git for version control and collaboration. Who We’re Looking For Product-Focused Mindset: You understand the purpose behind each task and ensure designs and implementations align with user needs. Strong work ethic and dedication: Willing to put in the extra time and effort needed to complete tasks, including working weekends or additional hours when required, with a focus on flexibility and commitment to delivering results. Self-Starter: You’re proactive, take ownership, and don’t require micro-management. Team Player: You enjoy collaborating with others and contributing ideas to improve the product. Communicator: You can clearly articulate solutions, risks, and decisions to team members. To apply: https://weworkremotely.com/remote-jobs/bbe-marketing-inc-senior-symfony-developer",2026-01-04
Senior Cloud Platform Engineer (AWS),Breezy HR,https://weworkremotely.com/remote-jobs/breezy-hr-senior-cloud-platform-engineer-aws,"Thu, 11 Dec 2025 02:38:57 +0000","Headquarters: Jacksonville, FL URL: https://breezy.hr/ Location: Remote (US) Team: Engineering • Platform/Infrastructure About Breezy HR Breezy HR is a remote-first, hiring platform built for small and mid-sized businesses. Thousands of teams trust us to streamline recruiting from first touch to signed offer, and we’re passionate about delivering a fast, delightful experience for every candidate and every hiring manager. Why we’re hiring We need a senior hands-on owner to stabilize, secure, and evolve our cloud platform. You’ll be a primary decision-maker for AWS architecture, reliability, CI/CD, observability, and cost posture, partnering closely with the directors, developers, product, and customer success teams. What you’ll own (hands-on + strategic) AWS architecture & operations: Own production infrastructure end-to-end (networking, compute, storage, IAM, routing, scaling, backups, DR). IaC & environments: Standardize and evolve Infrastructure-as-Code (Terraform or AWS CDK); codify dev/stage/prod with repeatable patterns and least-privilege IAM. CI/CD: Keep deployments fast and safe (build, test, deploy, rollback); drive progressive delivery where it makes sense. Observability & incident response: Ensure logs/metrics/traces + actionable dashboards; lead incident command and postmortems. Security & compliance: Own cloud security baselines and support SOC 2 / ISO 27001 / GDPR needs. Cost & performance: Right-size infra, track spend, and implement guardrails to prevent regressions. Technical leadership: Document the platform, unblock developers, mentor peers, and cultivate cross-training so nothing is a single point of failure. On-call: Alternate with others on the infra on-call rotation and train others as needed. Our stack Backend: Node.js microservices Data: MongoDB (self-hosted) and Redis Hosting/Orchestration: AWS IaC: Terraform and/or AWS CDK Tooling: Git-based CI/CD; common observability suites What you’ve done 7+ years building and running production systems on AWS (VPC, EC2, ELB/ALB, S3, CloudFront, Route53, RDS/ElastiCache, IAM, CloudWatch, SNS/SQS, etc.). 5+ years Infrastructure-as-Code (Terraform, CDK) and environment automation. Proven CI/CD ownership for multi-service SaaS, including safe rollbacks and release hygiene. Solid security fundamentals (least-privilege IAM, network segmentation, secrets, TLS) and familiarity with SOC 2 / ISO 27001 / GDPR expectations. Observability end-to-end (logs/metrics/traces), incident leadership, and postmortem practice. Proficient coding in JavaScript/Node.js (enough to contribute to internal tools, CLIs, or platform services). Clear, pragmatic communicator who documents decisions and trade-offs. Nice-to-haves Background with MongoDB, Redis, Elasticsearch Prior team leadership How we work Senior, low-ego, remote-first team. We value fast feedback loops, little yellow/red tape, ability to iterate at startup-like pace Benefits Comprehensive medical, dental, and vision insurance 401(k) with company match PTO: 15 days in year 1, 21 days in year 2 MacBook Pro + the gear you need Fully remote To apply: https://weworkremotely.com/remote-jobs/breezy-hr-senior-cloud-platform-engineer-aws",2026-01-04
Full Stack Developer,Nova,https://weworkremotely.com/remote-jobs/nova-full-stack-developer,"Mon, 10 Nov 2025 18:45:46 +0000","Headquarters: Toronto, Canada URL: https://www.createwithnova.com/ We are looking for a Full Stack Developer to join our Engineering team, reporting to the EVP Product & Engineering. The role is focused on web development & related infrastructure automation. We are looking for a developer who is comfortable and confident writing Python, SQL, and JavaScript on a daily basis. Competitive salary based on your experience and ability to contribute. You should be familiar with a healthy subset of the following: Languages: Python JavaScript TypeScript HTML CSS Frameworks/libraries: Django React Tailwind FastAPI FastHTML jQuery Puppeteer Jest Node Databases: MySQL Mongo Redis Clickhouse Infrastructure: Google Cloud Platform (GCP) Kubernetes Docker Terraform Linux We’re a 100% remote team: we keep in touch with each other via Slack and Zoom. You must have access to your own workspace with a reliable broadband internet connection (annual stipend for office expenses will be provided). From time-to-time, we hold “on-sites” in person to give everyone some face time with their colleagues (will involve very occasional travel). Preference will be given to applicants located in Canada. To apply: https://weworkremotely.com/remote-jobs/nova-full-stack-developer",2026-01-04
