title,company,url,published_date,description,scraped_date
Senior Data Scientist,BaxEnergy,https://weworkremotely.com/remote-jobs/baxenergy-senior-data-scientist-1,"Mon, 24 Nov 2025 15:21:10 +0000","Headquarters: Acireale, Italy URL: https://baxenergy.com We’re looking for a senior Data Scientist to join our growing team and tackle high-impact problems in the renewable energy space. You’ll lead end-to-end projects that apply machine learning and statistical modelling to real-world challenges such as forecasting power demand, predicting equipment failures, or optimizing energy usage. Rather than looking for a domain expert in energy renewables, what we need is someone who deeply understands data, knows how to build solid models, and can write clean Python code that’s production ready. If you’ve got a strong foundation in statistics, experience with time series data, and a passion for solving meaningful problems, we’d love to meet you. This role is fully remote. What You Will Do Lead data science initiatives and take responsibility for their execution. Analyse time series data and develop models for forecasting, anomaly detection, and optimization. Work closely with product, engineering, and domain experts to build features that get used. Bring clarity to messy data, test hypotheses, and make informed, modelling choices. Communicate your findings clearly to both technical and non-technical teammates. Contribute to best practices around reproducibility, testing, and model monitoring. About You Smart and gets things done You are a great data scientist and can contribute to creating great data science teams Strong background in statistics and machine learning theory. You know more than just how to fit a model, and you understand why it works. Solid experience working with time series data and building predictive models. Expert Python skills so that your code is efficient, maintainable, and ready for production including hands-on experience with standard data science tools (pandas, NumPy, scikit-learn, etc.). Solid remote work experience and student mindset You have a 4-hour overlap with CET time zones You’re eligible to obtain a visa and can travel to Italy within three months of hiring Why Join Us We are a remote-first company, and this is a fully remote position We build amazing teams with brilliant, happy, and motivated contributors Earn Euro-level salaries with over 30 days of vacation, sick pay, and other benefits The role is a permanent full-time position We invest in people and understand great things happen if we do Be part of our amazing company trajectory over the next five years Travel to Sicily, Italy once a year for a fully paid company retreat To apply: https://weworkremotely.com/remote-jobs/baxenergy-senior-data-scientist-1",2025-12-13
Python Developer,OnTheGoSystems,https://weworkremotely.com/remote-jobs/onthegosystems-python-developer,"Mon, 24 Nov 2025 13:50:40 +0000","Headquarters: Remote URL: http://onthegosystems.com We’re looking for a developer who wants to do more than deliver features . Join OTGS, the company behind WPML, and help build the core AI systems our teams rely on every day. You’ll work directly with senior engineers, have real influence on architecture and direction, and turn open-ended goals into production-ready systems that support our Support, Marketing, and VIP teams. This role isn’t about following specs. It’s about taking open-ended goals and turning them into reliable systems. Your work will reach production fast and matter immediately. What we’re looking for in our developer: Core AI engineering Strong Python Experience with OpenAI APIs, embeddings, vector databases Familiarity with multi-agent frameworks (CrewAI or similar) Systems engineering Async pipelines and background job processing SQL + PostgreSQL Docker + GitLab CI Clean integrations with external and internal APIs Engineering mindset Unit and integration testing Good logging & monitoring practices Ability to structure work independently and collaborate effectively with distributed teams Why join OTGS? Stable & self-funded since 2007 –  no external investors influencing priorities Fully remote, global team of kind, talented people Creators of WPML, powering 1.5M+ WordPress sites. Working on PTC, our next-gen SaaS localization platform Strong engineering culture with real autonomy Structured mentorship and clear growth opportunities Meaningful work that brings value If you want real ownership, deep technical work, and the chance to create systems that move things forward, apply today, and we are looking forward to getting to know you better! To apply: https://weworkremotely.com/remote-jobs/onthegosystems-python-developer",2025-12-13
Player-Coach Engineering Team Lead,Silverfin,https://weworkremotely.com/remote-jobs/silverfin-player-coach-engineering-team-lead,"Mon, 24 Nov 2025 13:23:30 +0000","Headquarters: Gent, Belgium URL: https://silverfin.com/ About the Role: The Highlights We're looking for an Engineering Team Lead to join our remote-first department and take the helm of Team Syncs . This is a Player-Coach role, meaning you'll balance hands-on technical contributions with people management, mentoring, and ensuring your team is aligned with the company's business priorities. If you thrive on both writing great code and fostering an environment where engineers can grow and do their best work—especially in the complex domain of data ingestion and API management—this is for you. Impact : Guide Team Syncs, a mission-critical team responsible for bringing complex financial data into Silverfin and ensuring its accuracy. Challenge : Work with 30+ external APIs, financial algorithms, and manage a public API for external integrations. Balance : Enjoy actual, proper work-life balance with flexible hours and no expectation of working beyond your contractual obligations. Growth : Participate in our Leadership Development Programme and receive a €1200 yearly budget for professional development. Perks : Two engineering retreats per year somewhere in Europe and ten company-wide Wellbeing Days per year (a paid Friday off). A Note about Compensation For this role, the compensation range is €112.000 - €169.000 a year , which reflects the total compensation band for Team Leads at this level. Please note: Most candidates start at the lower to mid part of the range, depending on experience and how their profile compares to our existing team. The higher end of the range is typically offered to individuals with a track record of strong impact and deep expertise in similar roles. We run annual compensation reviews, so there is clear opportunity for growth as you progress in the role. Our Commitment to a Welcoming & Inclusive Process At Silverfin, we are committed to building a diverse, equitable, and inclusive organisation. We value all our colleagues and do not discriminate based on race, religion, colour, national origin, gender, sexual orientation, age, marital status, disability status, or any other characteristic. We believe the best solutions come from diverse perspectives. To ensure an equitable hiring process, our policy is to only move to the interviewing stage once we have a sufficiently representative and diverse pool of applicants. This might mean a slight delay in scheduling interviews, but it's a vital step in our commitment to genuine equity. We strongly encourage you to apply even if you don't check every single box. We are looking for potential and unique contributions. Tell us how you can help us achieve our mission! What You'll Be Doing (Leading Team Syncs) As the Team Lead for Team Syncs , you will manage, mentor, and contribute to a team focused on the backbone of our platform—data connectivity and integrity. People Leadership & Alignment (The Coach) Manage and mentor a team of engineers, fostering a culture of collaboration and continuous improvement. Collaborate closely with the team’s Product Manager to set clear goals and priorities for data synchronization and API development. Partner with Team #1 of your fellow TLs to maintain a well-aligned Engineering department. Live the Silverfin values and be a role model for your team. Technical Contribution (The Player) Actively contribute to the team's codebase, dividing time between technical work and people management. Oversee the development and maintenance of integrations with external bookkeeping APIs , ensuring reliable and accurate data flow. Guide the team in maintaining our public Sync API , enabling third parties to build seamless bookkeeping integrations with Silverfin. Help the team refine algorithms and financial calculations necessary for data accuracy and correctness within the platform. Help with discovery and delivery of the best solutions for customer and business challenges. What We're Looking For Essential Requirements 2 years of experience leading a team, including direct people management. Recent hands-on experience as a Senior Software Engineer. Expertise with or willingness to quickly learn and work with Ruby on Rails. Enthusiasm and familiarity with AI tools for software development. Ability to communicate clearly in English , both verbally and in writing. Work hours have some overlap with EU business hours (local timezone within CET +/- 3h ). Willingness and ability to travel 3 to 4 times per year for team and company events. Helpful Experience (Nice-to-Haves) Experience with API design and building resilient, third-party integrations (highly relevant for Team Syncs). Experience in a fully remote working environment. Experience working with large datasets and ensuring data integrity. Experience in Fintech or with accounting/financial knowledge (highly relevant for the team's function). Experience with JavaScript framework(s). What Makes Silverfin Engineering Special Our Technology and Impact The Product: We apply software to automate the busywork of accounting, allowing our 15,000+ users to focus on other valuable aspects of the accountant role such as client advisory. The Stack: We run an up-to-date Rails monolith with PostgreSQL and Redis on a Kubernetes cluster in Google Cloud , with a number of satellite services - such as our AI applications. We follow a DevOps mindset —developers and ops work together to empower self-sufficiency. The Challenge: Our biggest stack includes a database exceeding 17TB, with tables over 10 billion rows, requiring careful thought on scalability and performance—especially crucial for Team Syncs' data ingestion role. Product Focus & Empowerment: We are organised into empowered cross-functional teams with software or AI engineers, product managers and product designers. Each team has a high-level mission and a lot of agency in deciding how to achieve it. Innovation: We have an in-house AI team applying machine learning to solve real client problems, with commercially successful, production-ready features. We're proudly part of Visma , a European leader in cloud software. True Work-Life Balance and Flexibility Asynchronous-First: We prioritize focused work. Important decisions are documented in Gitlab, email, or Quip (our wiki) to minimize interruptions. We discourage unnecessary Slack mentions and encourage using the ""Do Not Disturb"" function. Flexible Schedule: It's okay to disappear for a few hours in the middle of the day for personal appointments or errands. You fully decide when you take time off; if there aren’t enough people available, we’ll decrease the load instead of asking folks to move their holidays. Interested? You can apply today. There is no benefit to applying early, so take your time to consider the role and answer the application questions thoroughly. Apply for the job right here. Or email us with any questions: zoe.deswaef @silverfin.com We may use artificial intelligence (AI) tools to support parts of the hiring process, such as reviewing applications, analyzing resumes, or assessing responses. These tools assist our recruitment team but do not replace human judgment. Final hiring decisions are ultimately made by humans. If you would like more information about how your data is processed, please contact us. To apply: https://weworkremotely.com/remote-jobs/silverfin-player-coach-engineering-team-lead",2025-12-13
Senior Software Engineer (React/React Native),CompanyCam,https://weworkremotely.com/remote-jobs/companycam-senior-software-engineer-react-react-native,"Fri, 24 Oct 2025 21:15:52 +0000","Headquarters: Lincoln, Nebraska URL: https://companycam.com/ The Role We’re looking for a sharp, driven, problem-solving Senior Software Engineer (React/React Native) to join our engineering team. As a Senior Software Engineer , you’ll work alongside other engineers, designers, and product managers to tackle everything from huge company initiatives to modest but important bug fixes. While your primary focus will be frontend development, we value engineers who are T-shaped, bringing deep expertise in one area while being comfortable contributing in others. Whether that means leading the way on web and mobile, diving into backend code, or lending an extra set of eyes in discovery, you’ll collaborate with your teammates to move work forward. Most importantly, you’ll actively contribute to the evolution of the culture and processes of a growing engineering team, especially our client engineering discipline (this is what we call the frontend web and mobile disciplines collectively). We want devs with opinions on patterns, code organization, and processes to help make sure our codebases scale healthily, and an interest in mentoring to help make sure our devs do too. Working At CompanyCam Our engineering team is remote-first, spanning every time zone in the United States. We welcome people from all backgrounds and really don't care whether or not you have a CS degree or even a high school diploma. All that matters is that you're not an a**hole and you're good at what you do. At CompanyCam we’re driven to produce work with meaningful outcomes. That means not just dumping features and “improvements” but being able to reflect and learn from our outputs. We’re actively working to center our work on continuous discovery habits (CDH) as outlined by Teresa Torres. Our teams are made up of a product manager, a product designer, a tech lead and an appropriate number of engineers for the scope of your team. We take a flexible approach, pulling from Agile, Scrum, Kanban, and even Shape Up. Rather than being overly prescriptive, we provide guardrails and just enough constraints to keep teams moving. Each team is expected to collaborate, iterate, and refine their best practices to produce high-quality work. What You’ll Do Design, implement and deliver complex, cross-cutting features and systems in React and React Native, and occasionally in Ruby on Rails. Lead efforts to address technical debt and system reliability, proactively identifying areas for refactoring or optimization. Influence and evolve the architecture and system design, anticipating future needs and driving long-term improvements across services and applications. Set and uphold high standards for code quality, testing coverage, and documentation, mentoring others to do the same. Drive improvements to internal tooling to enhance developer experience and system resilience. Facilitate technical discussions and decision-making, helping the team navigate trade-offs and align on best solutions. Act as a point of escalation for complex technical challenges, supporting team members in unblocking progress. Partner closely with product managers, designers, and engineers, shaping feature direction by identifying technical opportunities, risks, and trade-offs early in discovery. What You’ll Bring Must-haves These are our non-negotiables: Show up : give us your best and have the courage to do difficult but necessary stuff. Grow up : be humble, take responsibility, learn continuously, and have a growth mindset. Do good : treat your co-workers and customers the way you want to be treated. 5+ years of experience working as a professional developer . (Not all years of experience are created equal, so this one isn't set in stone). Advanced proficiency in React and Redux , or an equivalent JS framework and state management library, with experience guiding architectural decisions and best practices for frontend systems. Experience with React Native or native iOS or Android. Experience contributing across the full stack, including front-end, back-end, and data layers. Demonstrated experience in leveraging artificial intelligence (AI) to build, enhance, or optimize tools and features within products, driving innovation and improving user experience. Ability to handle complex tasks and ambiguous problems without guidance. Understanding of business trade-offs and ability to effectively communicate the risks and benefits of various technical approaches. Strong collaboration skills with the ability to lift up the team by providing mentorship and proactive feedback. You live and work permanently in the U.S. (We’re not set up to hire outside the U.S.). Nice-to-haves You’ll encounter the following technologies with varying frequency — experience with them is a plus, but not required: GraphQL & REST Apollo & TanStack Query Ruby on Rails Android Studio & Xcode Native mobile development (Java, Objective-C, Kotlin, Swift) Snowflake Experience integrating with large language models (e.g., OpenAI, Gemini) Benefits and Compensation This is a salaried position at CompanyCam. Our salary range is $175,000 - $200,000 per year and is based on experience. We also offer meaningful equity and other benefits . CompanyCam is an equal-opportunity employer committed to respect, inclusion, and growth. We work hard, take responsibility, and support each other. Great ideas come from all backgrounds, and we carefully consider every applicant without regard to personal characteristics or traits. Even if your work experience doesn’t align perfectly, we encourage you to apply. What really matters to us is your potential, your passion, and your commitment to learning, innovation, and contributing meaningfully to our team. For any accommodations or technical issues related to the online application or interview process, please email jobs@companycam.com and we’ll respond promptly. Please do not include any medical or health information in your message. To apply: https://weworkremotely.com/remote-jobs/companycam-senior-software-engineer-react-react-native",2025-12-13
Senior Engineer - Fullstack,Chipcolate,https://weworkremotely.com/remote-jobs/chipcolate-senior-engineer-fullstack,"Fri, 21 Nov 2025 09:36:00 +0000","Headquarters: Milan URL: https://chipcolate.com Job Summary Chipcolate is hiring a Senior Engineer - Fullstack (Node + React) to craft end-to-end features for our high-throughput financial platform. You’ll write clean TypeScript on both server and client, design performant Postgres schemas, and ship delightful UIs that make complex agent activity feel effortless. Salary: €80.000 – €100.000 gross / year Location: Remote within ± 4 hours of Central European Time Employment type: Full-time, permanent DISCLAIMER Any application not matching the requirements will be automatically discarded and you won't hear back from us. Mind our time, do not apply if you are outside the expected timezone and if you don't have the required seniorship. Please input your GitHub profile as portfolio in the application form. The profile image is not required. Responsibilities Design, implement and test REST services in Node.js (Bun, TypeScript) running on containerized infra. Model and optimize datasets in Postgres (including partitioning, indexes, materialized views). Build responsive front-ends in React with modern tooling (vite, shadcn-ui, tailwind). Use React Query / TanStack Query for data-fetching, caching and optimistic updates. Own end-to-end features: requirements → architecture → code → CI/CD → observability dashboards. Collaborate with SREs to keep our HA, multi-region stack secure and performant. Experience & Qualifications Must-have 5+ years building production applications. Solid SQL skills and deep understanding of Postgres internals (query planner, locking, tuning). React expertise: hooks, context, component composition, performance profiling. Proficiency with TypeScript, Git, CI pipelines and Docker. Comfortable taking a user story from Figma wireframe to deployed feature. Nice-to-have Worked on OLAP / analytical workloads (e.g. column-store extensions, DuckDB, ClickHouse). Hands-on with React Query or comparable client caching libraries. Familiarity with event-driven architectures (Kafka, NATS, RabbitMQ). Experience with Supabase (self-hosted) on the backend Experience instrumenting apps with OpenTelemetry and Grafana. No degree required—show us shipped code, OSS commits, or anything that proves you can build. Benefits Flexible hours & fully remote Fast growing environment Fun and innovative application domain 24 days paid leave + local public holidays Competitive salary Home-Office Budget Company Laptop A special benefit discussed during the process Application Process Apply online with a CV and GitHub profile. Cultural chat and Technical deep-dive with our CTO (60 min, system-design & live problem-solving). Offer within 7 working days or final interview. Ready to make high-stakes infrastructure feel effortless? Apply today—let’s engineer reliability together. About Us Chipcolate is an Italian company of hardcore engineers focusing on orchestrating any scaling fleet, from edge devices, to agents, to servers. Historically we worked on embedded systems, web applications and 3D printing. At this time, we are working on scaling a fleet of autonomous agents providing high-throughput financial services. We operate in a quite unstructured and flexible way, that’s the only way to get speed and quality. We are engineering and first principles thinking driven. Learn more: chipcolate.com · LinkedIn (@chipcolate) · GitHub ( https://github.com/chipcolate ) To apply: https://weworkremotely.com/remote-jobs/chipcolate-senior-engineer-fullstack",2025-12-13
Applied AI Engineer Consultant,Bitovi,https://weworkremotely.com/remote-jobs/bitovi-applied-ai-engineer-consultant,"Tue, 21 Oct 2025 19:38:39 +0000","Headquarters: Chicago URL: https://bitovi.com JOIN OUR TEAM! Bitovi helps companies create better web applications. We are seeking candidates to help build production-ready Intelligent Automations and Agentic AI solutions for our diverse portfolio of enterprise clients. We guide our clients in building things the ""right way"": maintainable, scalable, tested, and documented. Bitovians are consultants who are knowledgeable and proficient communicators, helping enterprise clients make informed decisions for their applications. WHO YOU ARE We are looking for a candidate with the following attributes: Passion for using and building AI tools and solutions Proven ability to deliver real-world solutions and platforms Ability to lead and be an integral part of a team Strongly motivated and able to work autonomously Accepting of suggestions and constructive feedback Driven to continuously learn and improve Enjoys solving complex problems Specific experience: Developing automation tools at the enterprise level Building workflow automation using tools such as n8n or Rivet Strong working knowledge of TypeScript or Python, and LangChain Practical use of multiple AI models and content modalities Leveraging vector databases and advanced RAG techniques Utilizing tool calling and other advanced model features Working directly with clients or other stakeholders Other Skills we value: Some exposure to cloud deployments and management, including AWS, Docker, and Kubernetes Deep understanding of CI/CD pipelines, including GitHub actions, TravisCI, and CodeBuild Observability techniques, including logging, metrics, and tracing. Automated testing, including unit and integration testing, performance testing, and benchmarking Fine-tuning models or building custom models Deploying open-source models to production environments Designing and building robust feedback systems for reinforcement learning HOW TO APPLY: Please share a resume and LinkedIn profile and answer the additional questions. Yes, we read through all the answers! At this time, we are placing a preference on candidates Nearshore who can work a minimum of 6 hours of overlap with the Eastern Time Zone. Please note that we are not interested in working with recruiters. All job offers are contingent on passing a background check. To apply: https://weworkremotely.com/remote-jobs/bitovi-applied-ai-engineer-consultant",2025-12-13
